Count,No,Name,Date,State,ROC,Partners,Designated Partners,Obligation,Division,Activity
1,AAF-9563,BONBONNIERE BAKES LLP,2016-03-16,Karnataka,BANGALORE,0,2,400000,0,Manufacture of food products and beverages
1,AAF-9564,R H D B & CO LLP,2016-03-16,Maharashtra,MUMBAI,0,4,400000,0,Other Business Activities
1,AAF-9565,BUMBLEBEE HOME LLP,2016-03-16,Delhi,DELHI,2,2,3000000,0,"Manufacture articles of straw&plating materials wood&it's products&cork,except furniture"
1,AAF-9566,T.V.B. ENTERPRISES LLP,2016-03-16,Delhi,DELHI,0,2,400000,0,Other Business Activities
1,AAF-9567,PALM LAND HOTEL & RESORTS LLP,2016-03-16,Delhi,DELHI,0,2,40000,0,Real estate activities
1,AAF-9568,PINKY SKYSCRAPERS REAL ESTATE LLP,2016-03-16,Maharashtra,MUMBAI,0,2,400000,0,Construction
1,AAF-9569,VOIP HORIZON TECH SOLUTIONS LLP,2016-03-16,Karnataka,BANGALORE,0,2,400000,0,Computer and related activities
1,AAF-9570,FIDESSE CAPITAL ADVISORS LLP,2016-03-16,Karnataka,BANGALORE,0,3,40000,0,Activities auxiliary to financial intermediation
1,AAF-9571,PREMIER MOTORCYCLES LLP,2016-03-16,Telangana,HYDERABAD,0,2,400000,0,"Sale,Maintenance&Repair of motor vehicles and motor cycles;retail sale of automotive fuel"
1,AAF-9572,SNP INFRASTRUCTURE LLP,2016-03-16,Telangana,HYDERABAD,7,3,4847763560,0,Real estate activities
1,AAF-9573,MATHESIS ECO WAYS LLP,2016-03-16,Telangana,HYDERABAD,0,3,400000,0,Manufacture of textiles
1,AAF-9574,HILL RUBBERS LLP,2016-03-16,Karnataka,BANGALORE,0,2,400000,0,Manufacture of rubber and plastic products
1,AAF-9575,RASAS MARKETING LLP,2016-03-16,Karnataka,BANGALORE,0,2,160000,0,Other Business Activities
1,AAF-9576,VARANASHI LIFESTYLE LLP,2016-03-16,Karnataka,BANGALORE,0,2,120000,0,Other Business Activities
1,AAF-9577,MODERN SANITARY AND TILES LLP,2016-03-16,Bihar,ROC-PATNA,0,3,4000000,0,Other Business Activities
1,AAF-9578,PIK PLASTIC MARKETING LLP,2016-03-17,Gujarat,AHMEDABAD,3,2,520000,0,Manufacture of rubber and plastic products
1,AAF-9579,MUSCLE CHUNK HEALTH CARE LLP,2016-03-17,Karnataka,BANGALORE,0,2,4000,0,Other Business Activities
1,AAF-9580,SFS CONSTRUCTION LLP,2016-03-17,Gujarat,AHMEDABAD,4,2,400000,0,Construction
1,AAF-9581,AL BARI IMPORTERS AND EXPORTERS LLP,2016-03-17,Tamil Nadu,CHENNAI,0,4,400000,0,"Wholesale trade and commission trade, except of motor vehicles and motorcycles"
1,AAF-9582,MAVERICK OFFICE PRODUCTS AND SOLUTIONS L,2016-03-17,Tamil Nadu,CHENNAI,0,2,800000,0,Other Business Activities
1,AAF-9583,NITHILA KUVIYAL FASHION LLP,2016-03-17,Tamil Nadu,CHENNAI,0,2,40000,0,Manufacture of wearing apparel;dressing and dyeing of fur
1,AAF-9584,ACCUTAX SERVICES LLP,2016-03-17,Gujarat,AHMEDABAD,0,2,2000000,0,Other Business Activities
1,AAF-9585,VANS FINANCIAL CONSULTANCY LLP,2016-03-17,West Bengal,KOLKATA,0,2,20000000,0,Other Business Activities
1,AAF-9586,SANKET VINIMOY LLP,2016-03-17,West Bengal,KOLKATA,2,2,7120000,0,"Wholesale trade and commission trade, except of motor vehicles and motorcycles"
1,AAF-9587,LADAGS POVOROT RESEARCH AND DEVELOPMENT,2016-03-17,Karnataka,BANGALORE,0,2,400000,0,Research and Development
1,AAF-9588,SARTHA GLOBAL MARKETING LLP,2016-03-17,Delhi,DELHI,0,2,73109408,0,Other Business Activities
1,AAF-9589,XCELON INDUSTRIES LLP,2016-03-17,Gujarat,AHMEDABAD,0,2,400000,0,"Activities Agriculture, Hunting and related Service activities"
1,AAF-9590,RELIABLE MANUFACTURING SOLUTIONS LLP,2016-03-17,Maharashtra,PUNE,0,2,400000,0,"Manufacture of fabricated metal products, except machinery and equipments"
1,AAF-9591,ARJUN PATRA PROPERTIES LLP,2016-03-17,West Bengal,KOLKATA,3,2,6480000,0,Construction
1,AAF-9592,SWAYUM HOSPITALITY LLP,2016-03-17,Maharashtra,PUNE,0,2,400000,0,Hotels and Restaurants
1,AAF-9593,RAVING VIEW HIGHRISE LLP,2016-03-17,West Bengal,KOLKATA,0,2,400000,0,Real estate activities
1,AAF-9594,DHANDIA GEMS LLP,2016-03-17,Rajasthan,JAIPUR,0,4,4080000,0,Manufacture of furniture; manufacturing N.E.C.
1,AAF-9595,SM WELLNESS LLP,2016-03-17,Maharashtra,PUNE,0,2,400000,0,Hotels and Restaurants
1,AAF-9596,COEXIST VENTURES LLP,2016-03-17,Maharashtra,PUNE,0,2,400000,0,Other Business Activities
1,AAF-9597,PRAGMA SPACES LLP,2016-03-17,Maharashtra,PUNE,0,2,400000,0,Construction
1,AAF-9598,SHAURYA SPACE REALTORS & PROJECT MANAGEM,2016-03-17,Maharashtra,PUNE,2,2,400000,0,Construction
1,AAF-9599,ORCHID FURNISHINGS LLP,2016-03-17,Maharashtra,PUNE,1,2,400000,0,Manufacture of furniture; manufacturing N.E.C.
1,AAF-9600,ROOTS SPICES LLP,2016-03-17,Gujarat,AHMEDABAD,0,2,400000,0,"Activities Agriculture, Hunting and related Service activities"
1,AAF-9601,GLOBUS CAPITAL ADVISORS LLP,2016-03-17,Maharashtra,PUNE,0,2,400000,0,Other Business Activities
1,AAF-9602,SM BRISK CONSULTANTS LLP,2016-03-17,West Bengal,KOLKATA,0,2,4000000,0,Other Business Activities
1,AAF-9603,OMEGA TOTAL HEALTHCARE CONSULTANCY LLP,2016-03-17,Maharashtra,PUNE,0,2,400000,0,Other Business Activities
1,AAF-9604,NIKS ENTERTAINMENT LLP,2016-03-17,Maharashtra,PUNE,0,3,200000,0,Other Business Activities
1,AAF-9605,FILIX PROMOTERS LLP,2016-03-17,West Bengal,KOLKATA,0,2,400000,0,Real estate activities
1,AAF-9606,SURAT INFRABUILD PROJECTS LLP,2016-03-17,Gujarat,AHMEDABAD,1,2,20000000,0,Construction
1,AAF-9607,S S THEATRES LLP,2016-03-17,Tamil Nadu,CHENNAI,0,2,600000,0,"Recreational, cultural and sporting activities"
1,AAF-9608,GARIMA SHARES LLP,2016-03-17,Delhi,DELHI,0,2,20400000,0,Other Service activities
1,AAF-9609,EVIAR HOTELS AND RESORTS LLP,2016-03-17,Tamil Nadu,CHENNAI,0,2,800000,0,Hotels and Restaurants
1,AAF-9610,AEON DEVELOPERS LLP,2016-03-17,Maharashtra,PUNE,1,3,400000,0,Construction
1,AAF-9611,SELENGE REALTORS LLP,2016-03-17,West Bengal,KOLKATA,0,2,400000,0,Real estate activities
1,AAF-9612,ZEN MOTELS LLP,2016-03-17,West Bengal,KOLKATA,0,8,4400000,0,Hotels and Restaurants
1,AAF-9613,DON ROMAIN ESTATES LLP,2016-03-17,Karnataka,BANGALORE,0,2,416000,0,Real estate activities
1,AAF-9614,BINJRAJKA MINIATURE IMPEX LLP,2016-03-17,West Bengal,KOLKATA,0,2,4000000,0,Manufacture of furniture; manufacturing N.E.C.
1,AAF-9615,ADOF GAMES LLP,2016-03-17,Karnataka,BANGALORE,0,2,400000,0,Computer and related activities
1,AAF-9616,SEVA COMMERCIAL LLP,2016-03-17,West Bengal,KOLKATA,0,2,440000,0,"Retail trade,except of motor vehicles and motorcycles,repair of personal&household goods"
1,AAF-9617,SEVA BHAWAN LLP,2016-03-17,West Bengal,KOLKATA,2,2,4340000,0,Real estate activities
1,AAF-9618,AMBITION PLAZA LLP,2016-03-17,West Bengal,KOLKATA,2,2,4472000,0,Real estate activities
1,AAF-9619,MANISH MERCHANDISER LLP,2016-03-17,Rajasthan,JAIPUR,5,2,26890000,0,"Retail trade,except of motor vehicles and motorcycles,repair of personal&household goods"
1,AAF-9620,OMNITECH PROJECTS LLP,2016-03-17,West Bengal,KOLKATA,0,2,40000,0,Construction
1,AAF-9621,ACCURATE EXHIBITIONS LLP,2016-03-17,Maharashtra,PUNE,0,2,2000000,0,Other Business Activities
1,AAF-9622,CROSSLAND REALCON LLP,2016-03-17,West Bengal,KOLKATA,0,3,400000,0,Real estate activities
1,AAF-9623,MILAK RETAIL LLP,2016-03-17,Tamil Nadu,CHENNAI,0,2,800000,0,"Retail trade,except of motor vehicles and motorcycles,repair of personal&household goods"
1,AAF-9624,PROTEX PROPERTIES LLP,2016-03-17,West Bengal,KOLKATA,0,2,400000,0,Real estate activities
1,AAF-9625,SILVER VALLEY COFFEE EXPORTS LLP,2016-03-17,Telangana,HYDERABAD,0,2,400000,0,Manufacture of food products and beverages
1,AAF-9626,TALHIVE HR MANAGEMENT LLP,2016-03-17,Maharashtra,PUNE,0,2,200000,0,Other Business Activities
1,AAF-9627,MEHER-ABAD POLYCHEM LLP,2016-03-17,Gujarat,AHMEDABAD,1,3,17278400,0,Manufacture of chemicals and chemical products
1,AAF-9628,A MEDIA BREWING COMPANY LLP,2016-03-17,Maharashtra,PUNE,0,2,400000,0,"Recreational, cultural and sporting activities"
1,AAF-9629,GRAND CENTRUM REALTY LLP,2016-03-17,Maharashtra,PUNE,4,2,4000000,0,Real estate activities
1,AAF-9630,D K Y & ASSOCIATES LLP,2016-03-17,Maharashtra,MUMBAI,3,2,400000,0,Other Business Activities
1,AAF-9631,GOLDEN RIBBON EVENT MANAGEMENT LLP,2016-03-17,West Bengal,KOLKATA,0,2,40000,0,Other Business Activities
1,AAF-9632,BREGMA SCIENCE LLP,2016-03-17,Karnataka,BANGALORE,0,2,200000,0,Other Business Activities
1,AAF-9633,Y S PRASADE & CO. LLP,2016-03-17,Maharashtra,MUMBAI,4,2,400000,0,Other Business Activities
1,AAF-9634,MOUND VINTRADE LLP,2016-03-17,West Bengal,KOLKATA,1,2,6030000,0,"Wholesale trade and commission trade, except of motor vehicles and motorcycles"
1,AAF-9635,BANDUKIYA INFRA LLP,2016-03-17,Maharashtra,MUMBAI,0,3,400000,0,Construction
1,AAF-9636,PYROL ENERGY LLP,2016-03-17,Maharashtra,PUNE,0,3,40000000,0,"Sewage and refuse disposal, sanitation and similar activities"
1,AAF-9637,ERANGAL COMTRADE AND CONSULTANCY LLP,2016-03-17,Maharashtra,MUMBAI,0,2,800000,0,Other Business Activities
1,AAF-9638,SAWAN AGENCIES LLP,2016-03-17,Haryana,DELHI,0,3,3756000,0,"Wholesale trade and commission trade, except of motor vehicles and motorcycles"
1,AAF-9639,MAVERICK TALENT LLP,2016-03-17,Maharashtra,PUNE,0,2,200000,0,"Recreational, cultural and sporting activities"
1,AAF-9640,DISHA TRADERS LLP,2016-03-17,Maharashtra,MUMBAI,0,2,400000,0,"Wholesale trade and commission trade, except of motor vehicles and motorcycles"
1,AAF-9641,MAINARCH INDIA LLP,2016-03-17,Maharashtra,MUMBAI,0,2,400000,0,Construction
1,AAF-9642,BHASWAR VANIJ ENTERPRISES LLP,2016-03-17,Maharashtra,MUMBAI,3,2,37661200,0,"Wholesale trade and commission trade, except of motor vehicles and motorcycles"
1,AAF-9643,CH AND CL HOLDINGS LLP,2016-03-17,Tamil Nadu,COIMBATORE,0,2,27388680,0,Real estate activities
1,AAF-9644,VANGUARD EDU-TECH SOLUTIONS LLP,2016-03-17,Maharashtra,MUMBAI,0,2,1140000,0,Education
1,AAF-9645,EROZGAR ENTERPRISE LLP,2016-03-17,Maharashtra,PUNE,0,2,1600000,0,Other Business Activities
1,AAF-9646,GODIGITAL TECHNOLOGIES LLP,2016-03-17,Maharashtra,PUNE,0,2,200000,0,Computer and related activities
1,AAF-9647,NESTRO MARKETING LLP,2016-03-17,Kerala,ERNAKULAM,2,6,33600000,0,"Wholesale trade and commission trade, except of motor vehicles and motorcycles"
1,AAF-9648,VIHAAN MARINE SERVICES LLP,2016-03-17,Maharashtra,PUNE,0,4,40000000,0,Other Business Activities
1,AAF-9649,FALCON MEDIA LLP,2016-03-17,Maharashtra,MUMBAI,0,2,200000,0,Other Business Activities
1,AAF-9650,CEFIRE GLOBAL LLP,2016-03-17,Kerala,ERNAKULAM,0,2,400000,0,Other Service activities
1,AAF-9651,PRINCIPLE LANDS LLP,2016-03-17,Maharashtra,PUNE,0,2,400000,0,Construction
1,AAF-9652,FUTURE LAND & DEVELOPERS LLP,2016-03-17,Maharashtra,MUMBAI,0,5,400000,0,Real estate activities
1,AAF-9653,TMZ CONSULTANTZ LLP,2016-03-17,Delhi,DELHI,0,2,36400000,0,Real estate activities
1,AAF-9654,ENVISION VENTURES LLP,2016-03-17,Tamil Nadu,CHENNAI,1,4,400000,0,Real estate activities
1,AAF-9655,GOWTHAM ENTERPRISES LLP,2016-03-17,Tamil Nadu,CHENNAI,0,2,240000,0,Manufacture of furniture; manufacturing N.E.C.
1,AAF-9656,AMICO AGRI COMMODITIES LLP,2016-03-17,Maharashtra,MUMBAI,0,2,4000000,0,"Wholesale trade and commission trade, except of motor vehicles and motorcycles"
1,AAF-9657,OCTANS DESIGNS AND DEVELOPERS LLP,2016-03-17,Maharashtra,PUNE,0,2,400000,0,Construction
1,AAF-9658,AUSTRINUS BUILDERS AND DEVELOPERS LLP,2016-03-17,Maharashtra,PUNE,0,2,400000,0,Construction
1,AAF-9659,FLICKER FACILITY MANAGEMENT LLP,2016-03-17,Maharashtra,PUNE,0,2,400000,0,Other Business Activities
1,AAF-9660,FLEXIDEALZ ONLINE LLP,2016-03-17,Maharashtra,PUNE,0,2,200000,0,Other Business Activities
1,AAF-9661,GURU & RAM LLP,2016-03-17,Tamil Nadu,CHENNAI,5,2,280000,0,Other Business Activities
1,AAF-9662,OCEAN BLUE ENTERPRISE HOME CARE LLP,2016-03-17,West Bengal,KOLKATA,0,2,4400000,0,"Retail trade,except of motor vehicles and motorcycles,repair of personal&household goods"
1,AAF-9663,RSR PACKAGING LLP,2016-03-17,Assam,SHILLONG,0,3,400000,0,Other Service activities
1,AAF-9664,RACHNA CONSULTANTS AND CONTRACTORS LLP,2016-03-17,Maharashtra,MUMBAI,1,2,800000,0,Construction
1,AAF-9665,ROHAN TEX LLP,2016-03-17,Delhi,DELHI,1,2,1900000,0,Manufacture of textiles
1,AAF-9666,HIGH GROWTH TRADELINK LLP,2016-03-17,West Bengal,KOLKATA,0,2,400000,0,Real estate activities
1,AAF-9667,MEDEX SPECIALITIES LLP,2016-03-17,Maharashtra,MUMBAI,1,2,30240000,0,Other Business Activities
1,AAF-9668,TRS SOLUTIONS LLP,2016-03-17,Karnataka,BANGALORE,0,2,400000,0,Computer and related activities
1,AAF-9669,IRIS FACILITY MANAGEMENT GLOBAL SERVICES,2016-03-17,Telangana,HYDERABAD,0,2,400000,0,Other Business Activities
1,AAF-9670,COLITE STARTUP PARTNERS LLP,2016-03-17,Maharashtra,MUMBAI,0,2,400000,0,Other Business Activities
1,AAF-9671,WEBNOESYS IT SOLUTIONS LLP,2016-03-17,Karnataka,BANGALORE,0,3,400000,0,Computer and related activities
1,AAF-9672,PROTOCOL CONSULTING LLP,2016-03-17,Karnataka,BANGALORE,0,2,800000,0,Other Business Activities
1,AAF-9673,HEMMO PHARMA LLP,2016-03-17,Maharashtra,MUMBAI,2,2,6000000,0,Manufacture of chemicals and chemical products
1,AAF-9674,SAKSHI VISION DERIVATIVES LLP,2016-03-17,Rajasthan,JAIPUR,6,2,39400000,0,"Wholesale trade and commission trade, except of motor vehicles and motorcycles"
1,AAF-9675,CREDIT INDIA REALTORS LLP,2016-03-17,Delhi,DELHI,0,2,400000,0,Other Business Activities
1,AAF-9676,CAPE TRADING LLP,2016-03-17,Maharashtra,MUMBAI,2,2,400000,0,"Wholesale trade and commission trade, except of motor vehicles and motorcycles"
1,AAF-9677,COLITE CAPITAL ADVISORS LLP,2016-03-17,Maharashtra,MUMBAI,0,2,400000,0,Other Business Activities
1,AAF-9678,GANPATI GENERAL TRADING LLP,2016-03-17,Maharashtra,MUMBAI,0,2,400000,0,Manufacture of chemicals and chemical products
1,AAF-9679,EMBASSY CLUBS LLP,2016-03-17,Karnataka,BANGALORE,0,2,400000,0,"Recreational, cultural and sporting activities"
1,AAF-9680,DART INCORPORATED LLP,2016-03-17,Delhi,DELHI,0,2,401200,0,Real estate activities
1,AAF-9681,UP SOUTH MARKETING LLP,2016-03-17,Karnataka,BANGALORE,0,2,800000,0,Other Business Activities
1,AAF-9682,QUINTILLION BUSINESS SOLUTIONS LLP,2016-03-17,Delhi,DELHI,0,2,400000,0,Other Business Activities
1,AAF-9683,VIGA ENERGY TECH LLP,2016-03-17,Maharashtra,PUNE,0,2,160000,0,Other Business Activities
1,AAF-9684,HEMANT TEXTILE LLP,2016-03-17,Delhi,DELHI,0,2,400000,0,"Wholesale trade and commission trade, except of motor vehicles and motorcycles"
1,AAF-9685,PEEKAY RESOURCES LLP,2016-03-17,West Bengal,KOLKATA,1,2,5620000,0,"Retail trade,except of motor vehicles and motorcycles,repair of personal&household goods"
1,AAF-9686,PRIMEGHAR SMART HOMES LLP,2016-03-17,Maharashtra,MUMBAI,0,2,400000,0,Real estate activities
1,AAF-9687,ABROL REALTY LLP,2016-03-17,Maharashtra,MUMBAI,0,2,400000,0,Real estate activities
1,AAF-9688,5G COMMUNICATIONS LLP,2016-03-17,Delhi,DELHI,0,2,9200000,0,Other Business Activities
1,AAF-9689,MULTICITY HOSPITALITIES LIMITED LIABILIT,2016-03-17,Delhi,DELHI,0,2,400000,0,Hotels and Restaurants
1,AAF-9690,KRISHKARE COSMED LLP,2016-03-17,Maharashtra,MUMBAI,1,2,400000,0,Manufacture of chemicals and chemical products
1,AAF-9691,J AND M CONSTRUCTIONS LLP,2016-03-17,Maharashtra,PUNE,1,2,2000000,0,Construction
1,AAF-9692,DRAGONFLY HOLIDAYS LLP,2016-03-17,Maharashtra,MUMBAI,0,2,400000,0,"Supporting and auxiliary transport activities, activities of travel agencies"
1,AAF-9693,CAPSTAN TRADING LLP,2016-03-17,Maharashtra,MUMBAI,2,2,400000,0,"Wholesale trade and commission trade, except of motor vehicles and motorcycles"
1,AAF-9694,ETERNAL BLISS INDUSTRIES LLP,2016-03-17,Maharashtra,PUNE,0,2,200000,0,Other Business Activities
1,AAF-9695,YASHODEEP ENTERPRISES PHARMACEUTICAL DIS,2016-03-17,Maharashtra,MUMBAI,0,3,10000000,0,Other Business Activities
1,AAF-9696,KINGSTON HOMES LLP,2016-03-17,West Bengal,KOLKATA,0,2,400000,0,Real estate activities
1,AAF-9697,SUYASH HOSPITALITY LLP,2016-03-17,Maharashtra,PUNE,0,2,400000,0,Other Business Activities
1,AAF-9698,SAARVI PROFESSIONAL TECHNOSERV LLP,2016-03-17,Madhya Pradesh,GWALIOR,0,2,100000,0,Computer and related activities
1,AAF-9699,BHAWANI TYRES LLP,2016-03-17,Maharashtra,MUMBAI,0,2,400000,0,Other Business Activities
1,AAF-9700,MUKUND INDIA REALESTATE SERVICES LLP,2016-03-17,Madhya Pradesh,GWALIOR,0,2,400000,0,Real estate activities
1,AAF-9701,CASA MARIA PROPERTIES LLP,2016-03-17,Maharashtra,MUMBAI,2,2,400000,0,Construction
1,AAF-9702,STRATEGIC MINDS INVENTURES LLP,2016-03-17,Maharashtra,MUMBAI,0,2,200000,0,Other Business Activities
1,AAF-9703,TRAVEL TADKA LLP,2016-03-17,Maharashtra,MUMBAI,0,2,400000,0,Other Business Activities
1,AAF-9704,HANSYUGAL POSITIVE ATTITUDE LLP,2016-03-17,Maharashtra,MUMBAI,1,2,34600000,0,Health and Social Work
1,AAF-9705,PALM SHELTER ESTATE DEVELOPMENT LLP,2016-03-17,Maharashtra,MUMBAI,2,2,400000,0,Construction
1,AAF-9706,OCTAD CONSULTANCY LLP,2016-03-17,Telangana,HYDERABAD,5,2,73336000,0,Other Business Activities
1,AAF-9707,VIAMRSH ENTERPRISES LLP,2016-03-17,Karnataka,BANGALORE,0,2,200000,0,Other Business Activities
1,AAF-9708,ASPA VENTURES LLP,2016-03-17,Karnataka,BANGALORE,0,3,2000000,0,Other Business Activities
1,AAF-9709,JINENDRA MEDISALES LLP,2016-03-17,Karnataka,BANGALORE,1,2,400000,0,"Wholesale trade and commission trade, except of motor vehicles and motorcycles"
1,AAF-9710,CONSTELLATION REALTY VENTURES LLP,2016-03-17,Maharashtra,MUMBAI,0,2,400000,0,Real estate activities
1,AAF-9711,MANGALAM STAFFING SERVICES LLP,2016-03-17,Maharashtra,MUMBAI,0,2,10000000,0,Other Business Activities
1,AAF-9712,ANBEE CONSTRUCTIONS LLP,2016-03-17,Maharashtra,MUMBAI,2,2,400000,0,Construction
1,AAF-9713,VNINE INFO SOLUTIONS AND SERVICES LLP,2016-03-17,Karnataka,BANGALORE,4,2,48000,0,Computer and related activities
1,AAF-9714,BRIZEAL REALTORS AND DEVELOPERS LLP,2016-03-17,Maharashtra,MUMBAI,8,4,64400000,0,Real estate activities
1,AAF-9715,SPACE SOLUTION DEVELOPERS & INFRA-LOGIST,2016-03-17,Maharashtra,MUMBAI,8,2,4900000,0,Construction
1,AAF-9716,JEWELVUE LLP,2016-03-17,Karnataka,BANGALORE,0,2,400000,0,Other Business Activities
1,AAF-9717,SKETECH CLOTHING LLP,2016-03-17,Karnataka,BANGALORE,0,2,400000,0,"Retail trade,except of motor vehicles and motorcycles,repair of personal&household goods"
1,AAF-9718,VINS TRADING VENTURE LLP,2016-03-17,Karnataka,BANGALORE,0,2,400000,0,Other Service activities
1,AAF-9719,ARPWOOD CONSULTANTS LLP,2016-03-17,Maharashtra,MUMBAI,0,2,26640000,0,Other Business Activities
1,AAF-9720,PAREKH PRESIDENCY CENTRE REALTY LLP,2016-03-17,Maharashtra,MUMBAI,1,2,400000,0,Real estate activities
1,AAF-9721,ASHOK PLYWOOD TRADING COMPANY LLP,2016-03-17,Maharashtra,MUMBAI,0,2,40000000,0,Real estate activities
1,AAF-9722,CONCORDE EZPROPBUY INFRA LLP,2016-03-17,Karnataka,BANGALORE,0,4,400000,0,Other Business Activities
1,AAF-9723,FOXTAIL RODEO FOODS LLP,2016-03-17,Karnataka,BANGALORE,0,3,3000000,0,Manufacture of food products and beverages
1,AAF-9724,SHRI SIDDHI AVENUES LLP,2016-03-17,Maharashtra,MUMBAI,3,2,400200000,0,Construction
1,AAF-9725,SHOGUN BEVERAGES LLP,2016-03-17,Karnataka,BANGALORE,0,2,80000,0,Manufacture of food products and beverages
1,AAF-9726,VISHVAS ALLIANCE LLP,2016-03-18,Haryana,DELHI,0,2,200000,0,Other Business Activities
1,AAF-9727,BACKPLANE TECHNOLOGIES LLP,2016-03-18,Delhi,DELHI,0,2,200000,0,Computer and related activities
1,AAF-9728,MANTRAH LAW HOUSE LIMITED LIABILITY PART,2016-03-18,Delhi,DELHI,3,2,100000,0,Other Service activities
1,AAF-9729,VERTEX WIZARD LLP,2016-03-18,Delhi,DELHI,0,2,400000,0,Education
1,AAF-9730,COASTAL IMPEX LLP,2016-03-18,Maharashtra,MUMBAI,0,3,1000000,0,Manufacture of rubber and plastic products
1,AAF-9731,ARKA MEDIA WORKS ENTERTAINMENT LLP,2016-03-18,Telangana,HYDERABAD,1,2,200000,0,"Recreational, cultural and sporting activities"
1,AAF-9732,SRI BHAGWATKRIPA OVERSEAS LLP,2016-03-18,Telangana,HYDERABAD,0,4,4000000,0,"Manufacture articles of straw&plating materials wood&it's products&cork,except furniture"
1,AAF-9733,REVATI REALTY LLP,2016-03-18,Maharashtra,MUMBAI,1,2,39600000,0,Real estate activities
1,AAF-9734,EVISALINK INDIA LLP,2016-03-18,Maharashtra,MUMBAI,0,2,400000,0,"Supporting and auxiliary transport activities, activities of travel agencies"
1,AAF-9735,BROWNSTONE REALTY LLP,2016-03-18,Maharashtra,MUMBAI,1,2,200000,0,Real estate activities
1,AAF-9736,SP CINECORP PRODUCTIONS LLP,2016-03-18,Gujarat,AHMEDABAD,2,2,200000,0,"Recreational, cultural and sporting activities"
1,AAF-9737,KALPANA MUNSHI HOSPITAL LLP,2016-03-18,Gujarat,AHMEDABAD,0,4,200000,0,Health and Social Work
1,AAF-9738,ADITYA ENERGETIC TRADE SOLUTIONS LLP,2016-03-18,Gujarat,AHMEDABAD,0,2,200000,0,Construction
1,AAF-9739,CHRONOS TRIMPEX LLP,2016-03-18,Gujarat,AHMEDABAD,0,2,200000,0,"Wholesale trade and commission trade, except of motor vehicles and motorcycles"
1,AAF-9740,SUNDERDEEP INFRASTRUCTURE LLP,2016-03-18,Gujarat,AHMEDABAD,0,3,200200000,0,Construction
1,AAF-9741,UTOPIA HOTELS LIMITED LIABILITY PARTNERS,2016-03-18,Maharashtra,PUNE,3,5,9700400,0,Other Business Activities
1,AAF-9742,ROCK MOUNT MAN POWER SERVICES LLP,2016-03-18,Tamil Nadu,CHENNAI,0,2,20000,0,Other Business Activities
1,AAF-9743,WEIKFIELD INFRASTRUCTURE AND REAL ESTATE,2016-03-18,Maharashtra,PUNE,5,4,1940000,0,Real estate activities
1,AAF-9744,SWAYAM ETERNAL RESOURCES LLP,2016-03-18,Maharashtra,MUMBAI,3,2,10000000,0,Other Business Activities
1,AAF-9745,SHREE CHATRAPATI IMSR DIAGNOSTIC LLP,2016-03-18,Maharashtra,PUNE,0,3,100000,0,Health and Social Work
1,AAF-9746,SEVARTH SEVA UDYOG LLP,2016-03-18,Maharashtra,PUNE,0,2,100000,0,Other Business Activities
1,AAF-9747,RATNAMOHAN CAPITAL ADVISORS LLP,2016-03-18,Maharashtra,PUNE,0,2,1000000,0,Activities auxiliary to financial intermediation
1,AAF-9748,GARVA PROPERTIES LLP,2016-03-18,Maharashtra,PUNE,0,3,200000,0,Construction
1,AAF-9749,UNIQUE BAGS LLP,2016-03-18,Maharashtra,PUNE,0,2,100000,0,"Retail trade,except of motor vehicles and motorcycles,repair of personal&household goods"
1,AAF-9750,ROHAN PATE GROUP OF CONSTRUCTIONS LLP,2016-03-18,Maharashtra,PUNE,0,2,20000,0,Construction
1,AAF-9751,MALABAR PRIDE HOMES LLP,2016-03-18,Maharashtra,PUNE,0,3,200000,0,Construction
1,AAF-9752,HALOGEN ENTERPRISES LLP,2016-03-18,Maharashtra,PUNE,0,2,200000,0,Other Business Activities
1,AAF-9753,RAGHUKOOL ESTATE DEVELOPEMENT LLP,2016-03-18,Maharashtra,MUMBAI,2,2,200000,0,Construction
1,AAF-9754,TENTH GATE TECHNOLOGIES LLP,2016-03-18,Maharashtra,PUNE,0,2,200000,0,Other Business Activities
1,AAF-9755,AUROMERE INTEGRATED SERVICES LLP,2016-03-18,Maharashtra,PUNE,0,2,200000,0,"Supporting and auxiliary transport activities, activities of travel agencies"
1,AAF-9756,NAMOH LANDMARK LLP,2016-03-18,Maharashtra,PUNE,0,3,200000,0,Real estate activities
1,AAF-9757,CASABLANCA PREMISES LLP,2016-03-18,Maharashtra,MUMBAI,1,2,200000,0,Real estate activities
1,AAF-9758,DIRT N CLEAN (I) CONCIERGE LLP,2016-03-18,Maharashtra,PUNE,0,2,200000,0,Other Business Activities
1,AAF-9759,INTELLIQUICK SERVICES LLP,2016-03-18,Maharashtra,PUNE,0,2,100000,0,"Sale,Maintenance&Repair of motor vehicles and motor cycles;retail sale of automotive fuel"
1,AAF-9760,CYAN ESTATES LLP,2016-03-18,Maharashtra,MUMBAI,0,2,200000,0,Real estate activities
1,AAF-9761,REFRANICHE TECHNOLOGIES LLP,2016-03-18,Andra Pradesh,HYDERABAD,0,2,100000,0,Computer and related activities
1,AAF-9762,SEJAL SHAKTI REALTORS LLP,2016-03-18,Maharashtra,MUMBAI,5,4,101000000,0,Real estate activities
1,AAF-9763,FORTUNE TECHNICAL SERVICES LLP,2016-03-18,Tamil Nadu,CHENNAI,0,2,200000,0,Other Business Activities
1,AAF-9764,CHAKKRA TRANSPORT LLP,2016-03-18,Tamil Nadu,CHENNAI,0,2,200000,0,Land transport; Transport via pipelines
1,AAF-9765,CHIRAG SERVICES LLP,2016-03-18,Gujarat,AHMEDABAD,0,2,2000000,0,"Wholesale trade and commission trade, except of motor vehicles and motorcycles"
1,AAF-9766,SELTRON RESOURCE SOLUTIONS LLP,2016-03-18,Gujarat,AHMEDABAD,0,2,1000000,0,Recycling
1,AAF-9767,EARTHFIELD MINERALS LLP,2016-03-18,Gujarat,AHMEDABAD,0,2,600000,0,Mining of metal ores
1,AAF-9768,BUOYANT PROPERTIES LLP,2016-03-18,Maharashtra,MUMBAI,0,2,200000,0,Real estate activities
1,AAF-9769,KAISER APPARELS LLP,2016-03-18,Tamil Nadu,COIMBATORE,0,2,400000,0,Manufacture of textiles
1,AAF-9770,DANGI NAGORI CONSTRUCTION LLP,2016-03-18,Maharashtra,PUNE,0,2,40000,0,Construction
1,AAF-9771,EVON REALTY LLP,2016-03-18,Maharashtra,MUMBAI,0,2,200000,0,Real estate activities
1,AAF-9772,PRAMOD ONLINE VENTURES LLP,2016-03-18,Maharashtra,PUNE,0,2,200000,0,"Retail trade,except of motor vehicles and motorcycles,repair of personal&household goods"
1,AAF-9773,SAI INFRAMATERIALS LLP,2016-03-18,Maharashtra,MUMBAI,0,2,1000000,0,Construction
1,AAF-9774,KOKUM DESIGN SERVICES LLP,2016-03-18,Goa,GOA,0,2,200000,0,Other Service activities
1,AAF-9775,KHALIJTEL SERVICES LLP,2016-03-18,Tamil Nadu,COIMBATORE,0,2,100000,0,Computer and related activities
1,AAF-9776,ARJUN INFRACORP LLP,2016-03-18,Maharashtra,PUNE,0,2,200000,0,Construction
1,AAF-9777,FIREFLY REALTY LLP,2016-03-18,Maharashtra,MUMBAI,0,2,200000,0,Real estate activities
1,AAF-9778,AERO HOUSING AND LAND DEVELOPMENT LLP,2016-03-18,Delhi,DELHI,0,2,6240000,0,Real estate activities
1,AAF-9779,ELITE VALVES LLP,2016-03-18,Gujarat,AHMEDABAD,2,2,200000,0,Manufacture of machinery and equipment N.E.C.
1,AAF-9780,PARMAZ GREEN ARCADE LLP,2016-03-18,Goa,GOA,0,2,200000,0,Real estate activities
1,AAF-9781,MURLIDHAR FINANCIAL ADVISORY LLP,2016-03-18,Maharashtra,MUMBAI,1,2,200000,0,Other Business Activities
1,AAF-9782,DEEP WOODS FARMS LIMITED LIABILITY PARTN,2016-03-18,Goa,GOA,0,2,20000,0,"Activities Agriculture, Hunting and related Service activities"
1,AAF-9783,GILDED ROSE ESTATES LLP,2016-03-18,Maharashtra,MUMBAI,0,2,200000,0,Real estate activities
1,AAF-9784,KRISHNA AND SAURASTRI ASSOCIATES LLP,2016-03-18,Maharashtra,MUMBAI,0,3,800000,0,Other Business Activities
1,AAF-9785,GOLDEN BAY PROPERTIES LLP,2016-03-18,Maharashtra,MUMBAI,1,2,200000,0,Real estate activities
1,AAF-9786,SHASHIMI SINGH LLP,2016-03-18,Delhi,DELHI,0,2,200000,0,Manufacture of food products and beverages
1,AAF-9787,HILL CREST REALTY LLP,2016-03-18,Maharashtra,MUMBAI,1,2,200000,0,Real estate activities
