Count,No,Name,Date,State,ROC,Partners,Designated Partners,Obligation,Division,Activity
1,AAF-8902,HIND GLOBAL EXIM LLP,2016-03-09,Not assigned,AHMEDABAD,1,2,300000,0,"Supporting and auxiliary transport activities, activities of travel agencies"
1,AAF-8903,INITIOTECH INSTITUTE OF HARDWARE & NETWO,2016-03-09,Not assigned,ROC-PATNA,0,2,10000,0,Education
1,AAF-8904,SMITA ASSOCIATES LLP,2016-03-09,Not assigned,AHMEDABAD,0,2,100000,0,"Retail trade,except of motor vehicles and motorcycles,repair of personal&household goods"
1,AAF-8905,WARDHA MANUFECTRURES LLP,2016-03-09,Not assigned,ROC-PATNA,1,2,100000,0,Manufacture of tobacco products
1,AAF-8906,SERWELL LOGISTICS PARK LLP,2016-03-09,Not assigned,AHMEDABAD,0,5,1000000,0,"Supporting and auxiliary transport activities, activities of travel agencies"
1,AAF-8907,UBERDATA BUSINESS SOLUTION LLP,2016-03-09,Not assigned,AHMEDABAD,0,2,100000,0,Computer and related activities
1,AAF-8908,DARMAAN PHARMA LLP,2016-03-09,Not assigned,AHMEDABAD,0,2,100000,0,"Wholesale trade and commission trade, except of motor vehicles and motorcycles"
1,AAF-8909,HASHTAG FITNESS GEAR LLP,2016-03-09,Not assigned,MUMBAI,0,2,50000,0,Other Business Activities
1,AAF-8910,HEMANT FINSERVE LLP,2016-03-09,Not assigned,MUMBAI,1,2,50000,0,"Financial intermediation, except insurance and pension funding"
1,AAF-8911,SATVIKI TRADERS LLP,2016-03-09,Not assigned,KOLKATA,2,2,1579990,0,"Wholesale trade and commission trade, except of motor vehicles and motorcycles"
1,AAF-8912,MAYA MINIATURE LLP,2016-03-09,Not assigned,KOLKATA,1,3,1000000,0,Other Business Activities
1,AAF-8913,KANODIA BUILDERS LLP,2016-03-09,Not assigned,MUMBAI,0,2,50000000,0,Construction
1,AAF-8914,VALUEINC ADVISORY SERVICES LLP,2016-03-09,Not assigned,KOLKATA,0,2,100000,0,Activities auxiliary to financial intermediation
1,AAF-8915,KARPAGA VIRUSHA LLP,2016-03-09,Not assigned,CHENNAI,0,2,200000,0,"Wholesale trade and commission trade, except of motor vehicles and motorcycles"
1,AAF-8916,BLUEBELLS MEDICARE SERVICES LLP,2016-03-09,Not assigned,KOLKATA,0,4,10000000,0,Other Business Activities
1,AAF-8917,FRESHADVISE CONSULTANCY SERVICES LLP,2016-03-09,Not assigned,KOLKATA,0,2,100000,0,Activities auxiliary to financial intermediation
1,AAF-8918,GEO STONES GRANITES LLP,2016-03-09,Tamil Nadu,CHENNAI,0,2,100000,0,Other Mining and Quarrying
1,AAF-8919,DIGIBEAKONS TECHNOLOGIES LLP,2016-03-09,Not assigned,DELHI,0,3,75000,0,Other Business Activities
1,AAF-8920,KANHA AGRICULTURE LLP,2016-03-09,Not assigned,KOLKATA,2,2,1490000,0,"Activities Agriculture, Hunting and related Service activities"
1,AAF-8921,INTER CUISINE LLP,2016-03-09,Not assigned,KOLKATA,0,2,100000,0,Hotels and Restaurants
1,AAF-8922,D-MAX LEATHER OVERSEAS LLP,2016-03-09,Not assigned,KOLKATA,0,2,500200,0,"Tanning and dressing of leather,manufacture of luggage handbags,saddlery&harness&footwear"
1,AAF-8923,AUTOSHIELD CAR CARE LLP,2016-03-09,Not assigned,PUNE,0,2,100000,0,Other Business Activities
1,AAF-8924,A & A NIRMAN LLP,2016-03-09,Not assigned,KOLKATA,0,2,100000,0,Real estate activities
1,AAF-8925,PANTOMATH FUND MANAGERS LLP,2016-03-09,Not assigned,MUMBAI,0,2,100000,0,Other Business Activities
1,AAF-8926,TIRUMALA COMMODEAL LLP,2016-03-09,Not assigned,KOLKATA,2,2,550000,0,Other Business Activities
1,AAF-8927,SYON TECHNOSYS LLP,2016-03-09,Not assigned,JAIPUR,0,2,1000000,0,Computer and related activities
1,AAF-8928,OMNI PERFECT SOLUTIONS LIMITED LIABILITY,2016-03-09,Not assigned,ROC-PATNA,0,4,150000,0,Other Service activities
1,AAF-8930,IP 4 NETWORKERS LLP,2016-03-10,Karnataka,BANGALORE,0,2,200000,0,Computer and related activities
1,AAF-8931,EKLAKSHYA ACADEMY LLP,2016-03-10,Karnataka,BANGALORE,0,2,300000,0,Education
1,AAF-8932,APPRAISER BUSINESS COMPANION LLP,2016-03-10,Karnataka,BANGALORE,0,4,300000,0,Other Business Activities
1,AAF-8933,PUTHI-GYAN-CARRER CONSULTENCY LLP,2016-03-10,Karnataka,BANGALORE,0,2,10000,0,Education
1,AAF-8934,DHYUTHI SYNTHTEX LLP,2016-03-10,Karnataka,BANGALORE,0,2,100000,0,Other Business Activities
1,AAF-8935,DR BIOSCIENCES LLP,2016-03-10,Karnataka,BANGALORE,0,2,100000,0,Research and Development
1,AAF-8936,A.N. RESIDENCY LLP,2016-03-10,West Bengal,KOLKATA,0,2,100000,0,Real estate activities
1,AAF-8937,SARISHAA ARTS LLP,2016-03-10,Gujarat,AHMEDABAD,0,2,100000,0,Other Business Activities
1,AAF-8938,COSTIERO SHIPPING AND LOGISTICS LLP,2016-03-10,Gujarat,AHMEDABAD,0,2,100000,0,Water Transport
1,AAF-8939,PARAMARSA INDUSTRIAL SERVICES LLP,2016-03-10,Gujarat,AHMEDABAD,0,2,10000,0,Other Service activities
1,AAF-8940,SUPERTECH FABRICATIONS LLP,2016-03-10,Delhi,DELHI,0,2,100000,0,Other Business Activities
1,AAF-8941,ROCKSOLID FITNESS LLP,2016-03-10,Karnataka,BANGALORE,0,4,1000000,0,Other Business Activities
1,AAF-8942,AGINA PARTY SERVICES LLP,2016-03-10,Karnataka,BANGALORE,0,2,25000,0,Other Business Activities
1,AAF-8943,ARYADEEP INFRACON LLP,2016-03-10,West Bengal,KOLKATA,1,2,150000,0,Other Business Activities
1,AAF-8944,WINKLER JOINERY LLP,2016-03-10,Karnataka,BANGALORE,0,3,300000,0,Other Business Activities
1,AAF-8945,BOLAGARH AGRO LLP,2016-03-10,West Bengal,KOLKATA,3,2,820000,0,"Activities Agriculture, Hunting and related Service activities"
1,AAF-8946,ROSEWOOD TRADECOMM LLP,2016-03-10,West Bengal,KOLKATA,3,2,575000,0,Other Business Activities
1,AAF-8947,GANIA AGRO LLP,2016-03-10,West Bengal,KOLKATA,3,2,850000,0,"Activities Agriculture, Hunting and related Service activities"
1,AAF-8948,MADHUSUDANPUR AGRICULTURE LLP,2016-03-10,West Bengal,KOLKATA,6,2,500000,0,"Activities Agriculture, Hunting and related Service activities"
1,AAF-8949,DASPALLA OIL PALM LLP,2016-03-10,West Bengal,KOLKATA,5,3,800000,0,"Activities Agriculture, Hunting and related Service activities"
1,AAF-8950,ANAAR CORPORATION LLP,2016-03-10,Gujarat,AHMEDABAD,0,2,100000,0,"Wholesale trade and commission trade, except of motor vehicles and motorcycles"
1,AAF-8951,CHARICHAK AGRO LLP,2016-03-10,West Bengal,KOLKATA,6,2,750000,0,"Activities Agriculture, Hunting and related Service activities"
1,AAF-8952,PADAMPUR AGRO LLP,2016-03-10,West Bengal,KOLKATA,5,3,690000,0,"Activities Agriculture, Hunting and related Service activities"
1,AAF-8953,SHREE RADHAKRISHNA CORPORATE ADVISOR LLP,2016-03-10,Gujarat,AHMEDABAD,1,2,120000,0,Other Business Activities
1,AAF-8954,VS REGALEMENT INDIA LLP,2016-03-10,Maharashtra,PUNE,0,2,100000,0,Hotels and Restaurants
1,AAF-8955,DHRUV LAND & BUILDING LLP,2016-03-10,Delhi,DELHI,0,2,100000,0,Real estate activities
1,AAF-8956,POIBADI AGRO LLP,2016-03-10,West Bengal,KOLKATA,7,2,500000,0,"Activities Agriculture, Hunting and related Service activities"
1,AAF-8957,XENDER BIOPHARMA & RESEARCH LLP,2016-03-10,Gujarat,AHMEDABAD,3,2,100000,0,Manufacture of furniture; manufacturing N.E.C.
1,AAF-8958,SONEPUR AGRO LLP,2016-03-10,West Bengal,KOLKATA,6,3,810000,0,"Activities Agriculture, Hunting and related Service activities"
1,AAF-8959,HETERO ANALYTICAL SOLUTION LLP,2016-03-10,Gujarat,AHMEDABAD,6,2,100000,0,Other Business Activities
1,AAF-8960,ELITE GRAINCORP LLP,2016-03-10,Gujarat,AHMEDABAD,0,2,100000,0,"Wholesale trade and commission trade, except of motor vehicles and motorcycles"
1,AAF-8961,GKN ESTATE LLP,2016-03-10,Delhi,DELHI,0,3,100000,0,Real estate activities
1,AAF-8962,INTIMATE COMMERCIAL LLP,2016-03-10,West Bengal,KOLKATA,0,2,572890,0,Other Business Activities
1,AAF-8963,GOLDA CLOTHING LLP,2016-03-10,Chandigarh,CHANDIGARH,0,2,50000,0,"Retail trade,except of motor vehicles and motorcycles,repair of personal&household goods"
1,AAF-8964,ROVER DEALERS LLP,2016-03-10,West Bengal,KOLKATA,0,2,1866870,0,Other Business Activities
1,AAF-8965,BMKM REALTY HOMES LLP,2016-03-10,West Bengal,KOLKATA,0,2,100000,0,Real estate activities
1,AAF-8966,KMA COMPLEX LLP,2016-03-10,West Bengal,KOLKATA,0,2,100000,0,Real estate activities
1,AAF-8967,BMKM REALINFRA BUILDERS LLP,2016-03-10,West Bengal,KOLKATA,0,2,100000,0,Real estate activities
1,AAF-8968,SHREE RAM ECO-GREEN SHIP RECYCLING INDUS,2016-03-10,Gujarat,AHMEDABAD,0,4,100000,0,Recycling
1,AAF-8969,BMKM REALTY CONSTRUCTORS LLP,2016-03-10,West Bengal,KOLKATA,0,2,100000,0,Real estate activities
1,AAF-8970,LILY ADVISORY SERVICES LLP,2016-03-10,West Bengal,KOLKATA,0,2,100000,0,Other Business Activities
1,AAF-8971,BMKM HIGHRISE INFRA LLP,2016-03-10,West Bengal,KOLKATA,0,2,100000,0,Real estate activities
1,AAF-8972,BMKM REALTY ENCLAVE LLP,2016-03-10,West Bengal,KOLKATA,0,2,100000,0,Real estate activities
1,AAF-8973,KMA BUILDHOME LLP,2016-03-10,West Bengal,KOLKATA,0,2,100000,0,Real estate activities
1,AAF-8974,CAPITAL BUSINESS PARK LLP,2016-03-10,Andra Pradesh,HYDERABAD,2,2,108000,0,Manufacture of wearing apparel;dressing and dyeing of fur
1,AAF-8975,KMBM INFRA DEVELOPERS LLP,2016-03-10,West Bengal,KOLKATA,0,2,100000,0,Real estate activities
1,AAF-8976,SS3 INFRASTRUCTURE LLP,2016-03-10,Karnataka,BANGALORE,0,4,100000,0,Construction
1,AAF-8977,TRIMURTI BEVERAGES LLP,2016-03-10,West Bengal,KOLKATA,0,2,100000,0,Manufacture of food products and beverages
1,AAF-8978,DEVVRAT ENTERPRISES LLP,2016-03-10,West Bengal,KOLKATA,0,2,1000000,0,Other Service activities
1,AAF-8979,COINOMICS TECHNOLOGIES LLP,2016-03-10,Karnataka,BANGALORE,0,5,10000,0,Other Business Activities
1,AAF-8980,DOUBLE T CONSTRUCTION AND PROMOTERS LLP,2016-03-10,Tamil Nadu,CHENNAI,1,2,100000,0,Construction
1,AAF-8981,FUTURE TRADESOLUTION LLP,2016-03-10,West Bengal,KOLKATA,6,2,1000000,0,"Wholesale trade and commission trade, except of motor vehicles and motorcycles"
1,AAF-8982,RANWA CHOUDHARY ASSOCIATES LLP,2016-03-10,Rajasthan,JAIPUR,0,2,100000,0,Construction
1,AAF-8983,ADVANCE KNEE CARE LLP,2016-03-10,Delhi,DELHI,3,3,12840000,0,"Retail trade,except of motor vehicles and motorcycles,repair of personal&household goods"
1,AAF-8984,AASTHA CARE LLP,2016-03-10,Gujarat,AHMEDABAD,0,2,100000,0,Health and Social Work
1,AAF-8985,ORANGE KANDEE INTERNET SOLUTIONS LLP,2016-03-10,Tamil Nadu,CHENNAI,0,5,100000,0,Computer and related activities
1,AAF-8986,DECCAN GREEN INFRA PLANNING LLP,2016-03-10,Tamil Nadu,CHENNAI,1,2,5000000,0,Construction
1,AAF-8987,ATTY'S BAKERY AND CONFECTIONERY LLP,2016-03-10,Karnataka,BANGALORE,0,2,100000,0,Manufacture of food products and beverages
1,AAF-8988,TRISITA ENGINEERING LLP,2016-03-10,West Bengal,KOLKATA,0,2,50000,0,Computer and related activities
1,AAF-8989,GRACE AGRICARE FARMING LLP,2016-03-10,Delhi,DELHI,0,2,100000,0,"Activities Agriculture, Hunting and related Service activities"
1,AAF-8990,LIFE PULSE HEALTH SERVICES LLP,2016-03-10,Karnataka,BANGALORE,0,3,100000,0,Other Business Activities
1,AAF-8991,INNOVATIVE LAND INSPIRE LLP,2016-03-10,Gujarat,AHMEDABAD,0,2,100000,0,Other Business Activities
1,AAF-8992,JAI GEETA VINCOM LLP,2016-03-10,West Bengal,KOLKATA,2,2,400000,0,"Wholesale trade and commission trade, except of motor vehicles and motorcycles"
1,AAF-8993,BANPUR AGRO LLP,2016-03-10,West Bengal,KOLKATA,3,2,1000000,0,"Activities Agriculture, Hunting and related Service activities"
1,AAF-8994,ALLISAN STRUCTURE LLP,2016-03-10,Orissa,ROC-CUTTACK,0,2,200000,0,Real estate activities
1,AAF-8995,KANTAMAL AGRO LLP,2016-03-10,West Bengal,KOLKATA,6,2,840000,0,"Activities Agriculture, Hunting and related Service activities"
1,AAF-8996,PERFECT FINANCIAL MANAGEMENT LLP,2016-03-10,West Bengal,KOLKATA,0,2,100000,0,Other Service activities
1,AAF-8997,SURFACE INNOVATORS LLP,2016-03-10,Maharashtra,MUMBAI,0,2,100000,0,Other Business Activities
1,AAF-8998,MADHAPUR AGRO LLP,2016-03-10,West Bengal,KOLKATA,5,3,620000,0,"Activities Agriculture, Hunting and related Service activities"
1,AAF-8999,RANAPUR AGRO LLP,2016-03-10,West Bengal,KOLKATA,6,2,500000,0,"Activities Agriculture, Hunting and related Service activities"
1,AAF-9000,KRYPTON GLOBAL HEALTH LLP,2016-03-10,Delhi,DELHI,0,3,100000,0,"Wholesale trade and commission trade, except of motor vehicles and motorcycles"
1,AAF-9001,S R B A & CO LLP,2016-03-10,West Bengal,KOLKATA,2,2,4000,0,Other Business Activities
1,AAF-9002,PSV INFRA ENGINEERING LLP,2016-03-10,Delhi,DELHI,0,3,100000,0,Other Business Activities
1,AAF-9003,BUDDING IDEAS SERVICES LLP,2016-03-10,Delhi,DELHI,0,2,10000,0,Other Business Activities
1,AAF-9004,VAISHNAVI ORGANIC MILK LLP,2016-03-10,Maharashtra,MUMBAI,0,2,100000,0,Manufacture of food products and beverages
1,AAF-9005,SHREE GURUMAULI INFRATECH LLP,2016-03-10,Maharashtra,MUMBAI,0,2,100000,0,Other Business Activities
1,AAF-9006,PAC BUSINESS ADVISORS LLP,2016-03-10,Delhi,DELHI,0,2,100000,0,"Financial intermediation, except insurance and pension funding"
1,AAF-9007,AAMEYA POLYMERS LLP,2016-03-10,Madhya Pradesh,GWALIOR,0,2,1000000,0,Manufacture of rubber and plastic products
1,AAF-9008,SATYWADI MARKETING LLP,2016-03-10,Maharashtra,MUMBAI,0,2,1226250,0,Other Business Activities
1,AAF-9009,AMABOD IT SERVICES LLP,2016-03-10,Karnataka,BANGALORE,0,3,100000,0,Computer and related activities
1,AAF-9010,DHAPPA DESIGN LLP,2016-03-10,Delhi,DELHI,0,2,100000,0,Other Business Activities
1,AAF-9011,GALAXY MULTI-DEALERS LLP,2016-03-10,Maharashtra,MUMBAI,0,2,100000,0,Real estate activities
1,AAF-9012,PARKWEL PARKING SERVICES LLP,2016-03-10,Maharashtra,PUNE,0,2,50000,0,Other Business Activities
1,AAF-9013,SADHGURU PIPES LLP,2016-03-10,Chhaattisgarh,ROC-CHHATTISGARH,0,2,100000,0,"Manufacture of fabricated metal products, except machinery and equipments"
1,AAF-9014,HOPE CAPITAL SERVICES LLP,2016-03-10,Delhi,DELHI,0,2,1815600,0,Other Business Activities
1,AAF-9015,MASKEEN JI ENTERPRISES LLP,2016-03-10,Delhi,DELHI,0,2,100000,0,Real estate activities
1,AAF-9016,PEGASUS TEAM BUILDING SERVICES LIMITED L,2016-03-10,Delhi,DELHI,0,3,50000,0,Other Business Activities
1,AAF-9017,TEMPLAR SHIPPING SERVICES LLP,2016-03-10,Maharashtra,MUMBAI,0,2,10000,0,Water Transport
1,AAF-9018,SILQ INFRATECH LLP,2016-03-10,Delhi,DELHI,1,2,100000,0,Construction
1,AAF-9019,SYSKA MARKETING LLP,2016-03-10,Maharashtra,PUNE,0,2,100000,0,Other Business Activities
1,AAF-9020,TRIDENT BUILDER AND DEVELOPERS LLP,2016-03-10,Maharashtra,MUMBAI,0,2,50000,0,Construction
1,AAF-9021,CITY TRUCKS INDIA LLP,2016-03-10,Tamil Nadu,CHENNAI,0,3,100000,0,"Supporting and auxiliary transport activities, activities of travel agencies"
1,AAF-9022,VINCERE ADVISORS LLP,2016-03-10,Maharashtra,MUMBAI,0,2,100000,0,Other Business Activities
1,AAF-9023,MEDMART PHARMA LLP,2016-03-10,Maharashtra,MUMBAI,0,2,50000,0,Other Business Activities
1,AAF-9024,ADNEXUS HEALTH CARE LLP,2016-03-10,Maharashtra,MUMBAI,0,2,100000,0,Health and Social Work
1,AAF-9025,FIVE THIRTY AM ENTERPRISE LLP,2016-03-10,Maharashtra,MUMBAI,0,2,50000,0,"Wholesale trade and commission trade, except of motor vehicles and motorcycles"
1,AAF-9026,SUNRAY HERBALS LLP,2016-03-10,Maharashtra,MUMBAI,0,2,100000,0,Manufacture of chemicals and chemical products
1,AAF-9027,APP GRAPHICS LLP,2016-03-10,Maharashtra,MUMBAI,0,2,1000000,0,Other Business Activities
1,AAF-9028,UNITED INGREDIENTS LLP,2016-03-10,Maharashtra,MUMBAI,1,2,100000,0,Other Business Activities
1,AAF-9029,SHANGHAI SPICE FOODS LLP,2016-03-10,Maharashtra,MUMBAI,0,2,200000,0,Hotels and Restaurants
1,AAF-9030,HASBRO INDIA DEVELOPMENT LLP,2016-03-10,Maharashtra,MUMBAI,0,2,65001,0,Other Business Activities
1,AAF-9031,HASBRO INDIA SOURCING & OPERATIONS LLP,2016-03-10,Maharashtra,MUMBAI,0,2,65001,0,Other Business Activities
1,AAF-9032,TRENDY ACCESSORIES LLP,2016-03-10,Maharashtra,MUMBAI,0,3,150000,0,"Retail trade,except of motor vehicles and motorcycles,repair of personal&household goods"
1,AAF-9033,OHMOM ELECTRONICS LLP,2016-03-10,Maharashtra,MUMBAI,1,2,50000,0,Manufacture of electrical machinery and apparatus N.E.C.
1,AAF-9034,TEN TEN EVENTS LLP,2016-03-10,Maharashtra,MUMBAI,0,2,50000,0,Other Business Activities
1,AAF-9035,AUM PUNIT REALTY LLP,2016-03-10,Maharashtra,MUMBAI,0,7,100000,0,Real estate activities
1,AAF-9036,NATAN BIRYANI ON LEAF LLP,2016-03-11,Karnataka,BANGALORE,0,3,200000,0,Hotels and Restaurants
1,AAF-9037,ATTIC BOOKS PUBLISHING LLP,2016-03-11,Karnataka,BANGALORE,0,2,100000,0,"Publishing, printing and reproduction of recorded media"
1,AAF-9038,SHREEWORLD ACADEMY LLP,2016-03-11,Karnataka,BANGALORE,0,2,200000,0,Other Business Activities
1,AAF-9039,PARISARA BIO RENEWABLES LLP,2016-03-11,Karnataka,BANGALORE,0,3,800000,0,Recycling
1,AAF-9040,NEW MODE DEVELOPERS LLP,2016-03-11,Karnataka,BANGALORE,0,3,60000,0,Construction
1,AAF-9041,GROK COMMUNICATIONS LIMITED LIABILITY PA,2016-03-11,Karnataka,BANGALORE,0,3,200000,0,Other Business Activities
1,AAF-9042,ASHTAVINAYAK SWASTIK BUILDERS AND DEVELO,2016-03-11,Maharashtra,MUMBAI,0,2,100000,0,Construction
1,AAF-9043,NAVYA AUTO WORLD LLP,2016-03-11,Rajasthan,JAIPUR,0,3,200000,0,Other Business Activities
1,AAF-9044,AASHIRWAD CRITICARE LLP,2016-03-11,Maharashtra,MUMBAI,0,6,12000000,0,Health and Social Work
1,AAF-9045,CINE ZONE LLP,2016-03-11,Karnataka,BANGALORE,0,2,20000,0,Other Business Activities
1,AAF-9046,AC DOCTOR SERVICES LLP,2016-03-11,Maharashtra,MUMBAI,0,3,200000,0,Other Business Activities
1,AAF-9047,CIMMCO SALES LLP,2016-03-11,West Bengal,KOLKATA,1,2,390000,0,"Retail trade,except of motor vehicles and motorcycles,repair of personal&household goods"
1,AAF-9048,SPARROW COMMUNICATION LLP,2016-03-11,Delhi,DELHI,0,2,200000,0,"Recreational, cultural and sporting activities"
1,AAF-9049,THOMAS CLARKS CONSULTING LLP,2016-03-11,Karnataka,BANGALORE,0,2,200000,0,Other Business Activities
1,AAF-9050,VEES STAR DIAMONDS & JEWELRY LLP,2016-03-11,Tamil Nadu,CHENNAI,0,2,1442000,0,Manufacture of furniture; manufacturing N.E.C.
1,AAF-9051,FOOOKAT ONLINE SERVICES LLP,2016-03-11,Gujarat,AHMEDABAD,0,3,200000,0,Computer and related activities
1,AAF-9052,DEVROOTS IT CONSULTING LLP,2016-03-11,Karnataka,BANGALORE,0,2,20000,0,Computer and related activities
1,AAF-9053,AEVISTA TECHNICAL CONSULTANCY LLP,2016-03-11,Karnataka,BANGALORE,0,2,200000,0,Other Business Activities
1,AAF-9054,VSDS HEALTH INTEGRITY SOLUTIONS LLP,2016-03-11,Karnataka,BANGALORE,0,2,100000,0,Health and Social Work
1,AAF-9055,MARIGOLD PEOPLE MANAGEMENT SERVICES LLP,2016-03-11,Maharashtra,MUMBAI,0,2,200000,0,Other Business Activities
1,AAF-9056,EZDI SOLUTIONS (INDIA) LLP,2016-03-11,Gujarat,AHMEDABAD,1,2,2000000,0,Computer and related activities
1,AAF-9057,NUCLEUS DIAGNOSYS LLP,2016-03-11,Gujarat,AHMEDABAD,0,2,60000,0,Manufacture of chemicals and chemical products
1,AAF-9058,ADDIS BUILDCON LLP,2016-03-11,Gujarat,AHMEDABAD,0,2,200000,0,Construction
1,AAF-9059,OYSTER HOSPITAL LLP,2016-03-11,Maharashtra,MUMBAI,0,2,100000,0,Health and Social Work
1,AAF-9060,DIEU INNOVATIONS LLP,2016-03-11,Haryana,DELHI,0,2,200000,0,"Electricity, Gas, Steam and Hot water supply"
1,AAF-9061,ARTWORK DIGITEX LLP,2016-03-11,Gujarat,AHMEDABAD,0,4,10000000,0,Manufacture of textiles
1,AAF-9062,99INFOTECH LLP,2016-03-11,Delhi,DELHI,0,2,200000,0,Computer and related activities
1,AAF-9063,INZPIRA EDUCATION LLP,2016-03-11,Kerala,ERNAKULAM,0,2,160000,0,Education
1,AAF-9064,MKWAY LLP,2016-03-11,Rajasthan,JAIPUR,0,2,200000,0,Education
1,AAF-9065,SVC TECH VENTURES LLP,2016-03-11,Andra Pradesh,HYDERABAD,0,2,1000000,0,Other Service activities
1,AAF-9066,SLEEPY OWL COLD BREW COFFEE LLP,2016-03-11,Delhi,DELHI,0,2,1000000,0,Other Business Activities
1,AAF-9067,MAHARASHTRA ENTERPRISES LLP,2016-03-11,Maharashtra,MUMBAI,1,2,100000,0,Other Business Activities
1,AAF-9068,SUMANTRA CONSULTANCY SERVICES LLP,2016-03-11,Maharashtra,MUMBAI,1,2,825000,0,Other Business Activities
1,AAF-9069,NILKALA INDUSTRIES LLP,2016-03-11,Maharashtra,MUMBAI,0,2,900000,0,Manufacture of furniture; manufacturing N.E.C.
1,AAF-9070,PARWATI TRAEXIM LLP,2016-03-11,Delhi,DELHI,4,2,2634600,0,"Wholesale trade and commission trade, except of motor vehicles and motorcycles"
1,AAF-9071,NAVBHARAT SILK MILLS LLP,2016-03-11,Gujarat,AHMEDABAD,14,2,5818000,0,Manufacture of textiles
1,AAF-9072,EVOLUTION MOTO DESIGNS MOTORCYCLE ACCESS,2016-03-11,Maharashtra,MUMBAI,0,2,200000,0,Manufacture of machinery and equipment N.E.C.
1,AAF-9073,PYDI AUTOMOTIVE LLP,2016-03-11,Andra Pradesh,HYDERABAD,0,2,400000,0,"Sale,Maintenance&Repair of motor vehicles and motor cycles;retail sale of automotive fuel"
1,AAF-9074,MAHESH ENETRPRISES MARINE AND PORT SERVI,2016-03-11,Maharashtra,MUMBAI,2,2,200000,0,Other Business Activities
1,AAF-9075,AMPLE AUXILIARY SERVICE LIMITED LIABILIT,2016-03-11,Delhi,DELHI,1,2,306000,0,Other Business Activities
1,AAF-9076,INTRADE TRADING LLP,2016-03-11,Delhi,DELHI,0,2,100000,0,Other Business Activities
1,AAF-9077,IKAN ENTERPRISES LLP,2016-03-11,Delhi,DELHI,0,2,40000,0,Other Business Activities
1,AAF-9078,SAIAANSH ENTERPRISES LLP,2016-03-11,Delhi,DELHI,0,2,200000,0,"Retail trade,except of motor vehicles and motorcycles,repair of personal&household goods"
1,AAF-9079,PHENOM COACHING SYSTEMS LLP,2016-03-11,Maharashtra,MUMBAI,2,2,20000,0,Education
1,AAF-9080,VSQUAREPH BEVERAGES LLP,2016-03-11,Maharashtra,MUMBAI,0,2,4000000,0,Manufacture of food products and beverages
1,AAF-9081,ROYALOAK INFRASTRUCTURE LLP,2016-03-11,Karnataka,BANGALORE,2,2,200000,0,Real estate activities
1,AAF-9082,WOODS IMPEX LLP,2016-03-11,Karnataka,BANGALORE,2,2,200000,0,"Retail trade,except of motor vehicles and motorcycles,repair of personal&household goods"
1,AAF-9083,POHR INNOVATIVE SOLUTIONS LLP,2016-03-11,Karnataka,BANGALORE,0,2,20000,0,"Retail trade,except of motor vehicles and motorcycles,repair of personal&household goods"
1,AAF-9084,DS LOGIC ADVANCED SYSTEMS LLP,2016-03-11,Karnataka,BANGALORE,0,2,200000,0,Other Business Activities
1,AAF-9085,KUSKA AGRO LLP,2016-03-11,West Bengal,KOLKATA,6,3,1260000,0,"Activities Agriculture, Hunting and related Service activities"
1,AAF-9086,MAHABAL BUSINESS CENTRE LLP,2016-03-11,Maharashtra,MUMBAI,1,2,298800,0,Computer and related activities
1,AAF-9087,ACE TRADERS LLP,2016-03-11,West Bengal,KOLKATA,2,2,14200000,0,"Wholesale trade and commission trade, except of motor vehicles and motorcycles"
1,AAF-9088,PRERNA MANPOWER SOLUTIONS LLP,2016-03-11,West Bengal,KOLKATA,0,2,200000,0,Other Business Activities
1,AAF-9089,KISHORI IMPEX LLP,2016-03-11,West Bengal,KOLKATA,0,2,2120000,0,"Wholesale trade and commission trade, except of motor vehicles and motorcycles"
1,AAF-9090,ESHA VANIJYA LLP,2016-03-11,West Bengal,KOLKATA,0,2,2120000,0,"Wholesale trade and commission trade, except of motor vehicles and motorcycles"
1,AAF-9091,N K K AGRO LLP,2016-03-11,Kerala,ERNAKULAM,0,5,3000000,0,"Activities Agriculture, Hunting and related Service activities"
1,AAF-9092,FOS ELECTRONIC SOLUTIONS LLP,2016-03-11,Kerala,ERNAKULAM,0,2,200000,0,Other Business Activities
1,AAF-9093,TACHYON FOOTCARE LIMITED LIABILITY PARTN,2016-03-11,Kerala,ERNAKULAM,13,2,2600000,0,"Tanning and dressing of leather,manufacture of luggage handbags,saddlery&harness&footwear"
1,AAF-9094,FINETHAS DISPLAYS LIMITED LIABILITY PART,2016-03-11,Kerala,ERNAKULAM,0,2,10000000,0,"Wholesale trade and commission trade, except of motor vehicles and motorcycles"
1,AAF-9095,FUN SNACKS LLP,2016-03-11,Delhi,DELHI,0,2,200440,0,Manufacture of food products and beverages
1,AAF-9096,BSR CORPORATE ADVISORS LLP,2016-03-11,Delhi,DELHI,0,2,40000,0,Other Business Activities
1,AAF-9097,MAHARANI CONSULTANCY LLP,2016-03-11,Delhi,DELHI,0,2,2362000,0,"Financial intermediation, except insurance and pension funding"
1,AAF-9098,NEOWIS TECHNOLOGIES LLP,2016-03-11,Kerala,ERNAKULAM,0,2,60000,0,Other Business Activities
1,AAF-9099,PAN INDIA VACATIONS LLP,2016-03-11,Haryana,DELHI,0,2,20000,0,"Supporting and auxiliary transport activities, activities of travel agencies"
1,AAF-9100,GREEN DOT WELLNESS PRODUCTS LLP,2016-03-11,Maharashtra,MUMBAI,0,4,80000,0,Other Business Activities
1,AAF-9101,ELITE OVERSEAS HR SOLUTIONS LLP,2016-03-11,Delhi,DELHI,0,2,200000,0,Other Business Activities
1,AAF-9102,ANASHMAN TRADING LLP,2016-03-11,Maharashtra,MUMBAI,0,4,1099360,0,Other Business Activities
1,AAF-9103,BUNDELKHAND NIRMAN LLP,2016-03-11,Madhya Pradesh,GWALIOR,1,2,200000,0,Construction
1,AAF-9104,HG JEWELS LLP,2016-03-11,Maharashtra,MUMBAI,0,2,200000,0,Manufacture of furniture; manufacturing N.E.C.
1,AAF-9105,VISHVA TOURISM & HOSPITALITY LLP,2016-03-11,Maharashtra,MUMBAI,0,4,200000,0,"Recreational, cultural and sporting activities"
1,AAF-9106,LIGHTHOUSE WELLNESS LLP,2016-03-11,Maharashtra,MUMBAI,0,2,200000,0,Other Business Activities
1,AAF-9107,BASRA BROTHERS LLP,2016-03-11,Punjab,CHANDIGARH,0,2,1000000,0,Other Business Activities
1,AAF-9108,INTERCITY MOBILITY SOLUTIONS LLP,2016-03-11,Haryana,DELHI,0,2,400000,0,Other Business Activities
1,AAF-9109,N.R.M. AUTOMOBILES LLP,2016-03-11,Madhya Pradesh,GWALIOR,0,2,200000,0,"Sale,Maintenance&Repair of motor vehicles and motor cycles;retail sale of automotive fuel"
1,AAF-9110,SUITS STAR LIMITED LIABILITY PARTNERSHIP,2016-03-11,Haryana,DELHI,0,2,400000,0,Manufacture of textiles
1,AAF-9111,HITECH INTERIOR SERVICES LLP,2016-03-11,Maharashtra,MUMBAI,0,2,200000,0,Other Business Activities
1,AAF-9112,ANNOINTED ADVISORY LLP,2016-03-11,Chandigarh,CHANDIGARH,0,2,100000,0,Other Service activities
1,AAF-9113,USHA SARA PLACEMENT SERVICES LLP,2016-03-11,Maharashtra,MUMBAI,0,2,200000,0,Other Business Activities
1,AAF-9114,DEEP WOODS CONDIMENTS AND FOODS LIMITED,2016-03-11,Goa,GOA,0,2,20000,0,Manufacture of food products and beverages
1,AAF-9115,HAPPY TIMES HOLIDAYS LLP,2016-03-11,Goa,GOA,0,2,40000,0,Hotels and Restaurants
1,AAF-9116,KORKANE INTERNATIONAL LLP,2016-03-11,Maharashtra,MUMBAI,0,2,40000,0,Manufacture of food products and beverages
1,AAF-9117,SHAH SHETH & CO LLP,2016-03-11,Maharashtra,MUMBAI,0,2,200000,0,Activities of membership organizations N.E.C.
1,AAF-9118,PLASMASOLAR LLP,2016-03-11,Karnataka,BANGALORE,0,2,200000,0,Other Business Activities
1,AAF-9119,KNJ ELECTRICAL SYSTEMS LLP,2016-03-11,Karnataka,BANGALORE,0,2,200000,0,"Retail trade,except of motor vehicles and motorcycles,repair of personal&household goods"
