Count,No,Name,Date,State,ROC,Partners,Designated Partners,Obligation,Division,Activity
1,AAF-8249,PRIMEVISION REALTY LLP,2016-03-01,Maharashtra,MUMBAI,45,2,900000,0,Real estate activities
1,AAF-8250,AMIT PLASTOTECH LLP,2016-03-01,Rajasthan,JAIPUR,0,3,600000,0,Manufacture of rubber and plastic products
1,AAF-8251,SENSE COMSYS SOLUTIONS LLP,2016-03-01,Maharashtra,MUMBAI,0,2,300000,0,Other Business Activities
1,AAF-8252,DAFFODIL MEGA STRUCTURE LLP,2016-03-01,Maharashtra,MUMBAI,2,2,403272000,0,Construction
1,AAF-8253,PROGRO VENTURES AND ADVISORS LLP,2016-03-01,Maharashtra,MUMBAI,0,2,600000,0,Other Business Activities
1,AAF-8254,RELIABLE EXIM (INDIA) LLP,2016-03-01,Maharashtra,MUMBAI,0,2,3000000,0,Manufacture of textiles
1,AAF-8255,TECHINCEPT TECHNOLOGIES LIMITED LIABILIT,2016-03-01,Maharashtra,MUMBAI,1,2,600000,0,Computer and related activities
1,AAF-8256,AAF-8256,2016-03-01,Maharashtra,MUMBAI,0,2,300000,0,Other Business Activities
1,AAF-8257,RADHIYA SOLUTION LLP,2016-03-01,Gujarat,AHMEDABAD,0,2,600000,0,"Retail trade,except of motor vehicles and motorcycles,repair of personal&household goods"
1,AAF-8258,PARCOMM ENGINEERING LLP,2016-03-01,West Bengal,KOLKATA,0,2,6000000,0,Manufacture of machinery and equipment N.E.C.
1,AAF-8259,MANOJ DHUPELIA STOCK BROKING SERVICES LL,2016-03-01,West Bengal,KOLKATA,2,2,27612000,0,Other Business Activities
1,AAF-8260,SOUTHERN PACIFIC ENERGIES LLP,2016-03-01,West Bengal,KOLKATA,0,2,60000,0,Other Business Activities
1,AAF-8261,YASH ILLUMINATION LLP,2016-03-01,Maharashtra,MUMBAI,0,2,600000,0,"Wholesale trade and commission trade, except of motor vehicles and motorcycles"
1,AAF-8262,ROSS ENTERPRISES LLP,2016-03-01,Maharashtra,MUMBAI,0,2,600000,0,Other Business Activities
1,AAF-8263,SUNGLOW HIRISE LLP,2016-03-01,West Bengal,KOLKATA,1,2,600000,0,Real estate activities
1,AAF-8264,TALSTEER CONSULTING LLP,2016-03-01,Karnataka,BANGALORE,0,2,600000,0,Other Business Activities
1,AAF-8265,NADAKKAVU LIFE SPACES LLP,2016-03-01,Karnataka,BANGALORE,0,2,120000000,0,Real estate activities
1,AAF-8266,KLOSTES APPARELS LLP,2016-03-01,Karnataka,BANGALORE,0,2,600000,0,Manufacture of wearing apparel;dressing and dyeing of fur
1,AAF-8267,INTERLINK TRANSLATION SERVICES LLP,2016-03-01,Karnataka,BANGALORE,0,2,600000,0,Other Business Activities
1,AAF-8268,DOXA SERVICED OFFICES LLP,2016-03-01,Tamil Nadu,CHENNAI,0,2,600000,0,Other Business Activities
1,AAF-8269,ETOMATE TECHNOLOGY LLP,2016-03-01,Karnataka,BANGALORE,0,2,600000,0,Computer and related activities
1,AAF-8270,KEMPMANN BIO ORGANICS LLP,2016-03-01,Karnataka,BANGALORE,0,3,1800000,0,Other Business Activities
1,AAF-8271,SUNDERVAN HOSPITALITY LLP,2016-03-01,Maharashtra,MUMBAI,0,2,1200000,0,Hotels and Restaurants
1,AAF-8272,STRATNEL TECHNOLOGIES LLP,2016-03-01,Karnataka,BANGALORE,0,2,6000000,0,Other Business Activities
1,AAF-8273,AMIN EQUIPMENT LLP,2016-03-01,Gujarat,AHMEDABAD,0,4,21000000,0,"Sale,Maintenance&Repair of motor vehicles and motor cycles;retail sale of automotive fuel"
1,AAF-8274,VISHAL ASSOCIATES LLP,2016-03-01,Delhi,DELHI,0,3,1068000,0,Manufacture of paper and paper
1,AAF-8275,VISOR SHIPPING AGENCIES LLP,2016-03-01,Gujarat,AHMEDABAD,0,2,600000,0,Other Business Activities
1,AAF-8276,SALTEK PHARMACEUTICALS LLP,2016-03-01,Gujarat,AHMEDABAD,0,2,600000,0,Manufacture of chemicals and chemical products
1,AAF-8277,YOUR SPACE DOCTOR LIMITED LIABILITY PART,2016-03-01,Maharashtra,MUMBAI,0,5,300000,0,"Supporting and auxiliary transport activities, activities of travel agencies"
1,AAF-8278,KM ALLIANCE LLP,2016-03-01,Gujarat,AHMEDABAD,0,2,60000,0,Other Business Activities
1,AAF-8279,EARTHY NOTES ENTERPRISE LLP,2016-03-01,Karnataka,BANGALORE,0,3,1800000,0,"Wholesale trade and commission trade, except of motor vehicles and motorcycles"
1,AAF-8280,RAV ENCLAVES LLP,2016-03-01,West Bengal,KOLKATA,0,2,3000000,0,Real estate activities
1,AAF-8281,SIDDHI GANPATI WAREHOUSE & DISTRIBUTION,2016-03-01,West Bengal,KOLKATA,0,3,5400000,0,Other Business Activities
1,AAF-8282,SUDHAKAR BARTER LLP,2016-03-01,West Bengal,KOLKATA,2,2,18312000,0,"Financial intermediation, except insurance and pension funding"
1,AAF-8283,VENDORGLOBE PROCUREMENT SERVICES LLP,2016-03-01,Karnataka,BANGALORE,1,2,600000,0,Computer and related activities
1,AAF-8284,EXPLORE EXHIBITIONS & CONFERENCE LLP,2016-03-01,Karnataka,BANGALORE,0,2,600000,0,"Recreational, cultural and sporting activities"
1,AAF-8285,KANKARIYA INDUSTRIES LLP,2016-03-01,Maharashtra,PUNE,0,2,15000000,0,"Sale,Maintenance&Repair of motor vehicles and motor cycles;retail sale of automotive fuel"
1,AAF-8286,SAN CREATION LLP,2016-03-01,Maharashtra,PUNE,0,2,300000,0,Construction
1,AAF-8287,SOCIAL TRADERS LLP,2016-03-01,Maharashtra,PUNE,0,2,600000,0,Computer and related activities
1,AAF-8288,SWATI VINTRADE LLP,2016-03-01,West Bengal,KOLKATA,0,2,1800000,0,Other Business Activities
1,AAF-8289,SARTHENA ADVISORS LLP,2016-03-01,Karnataka,BANGALORE,0,3,6000000,0,Other Business Activities
1,AAF-8290,GREAT DEALS REALITY LLP,2016-03-01,Karnataka,BANGALORE,0,2,300000,0,Other Business Activities
1,AAF-8291,I3 VENTURA INFO SOLUTIONS LLP,2016-03-01,Karnataka,BANGALORE,0,3,60000,0,Computer and related activities
1,AAF-8292,RAGHUNATH TRADING LLP,2016-03-01,Maharashtra,MUMBAI,1,2,600000,0,Other Business Activities
1,AAF-8293,SRIGK PROPERTIES LLP,2016-03-01,Karnataka,BANGALORE,0,4,1800000,0,Real estate activities
1,AAF-8294,EMARK CONSTRUCTIONS LLP,2016-03-01,Maharashtra,PUNE,0,2,600000,0,Construction
1,AAF-8295,PUNCHTATTVA ENTERTAINMENT LLP,2016-03-01,Maharashtra,MUMBAI,0,4,240000,0,Other Business Activities
1,AAF-8296,LEAP2EXCEL CONSULTING LLP,2016-03-01,Maharashtra,PUNE,0,4,1200000,0,Other Service activities
1,AAF-8297,DOCTOR DIARY LLP,2016-03-01,Karnataka,BANGALORE,0,2,1200000,0,Computer and related activities
1,AAF-8298,MAHABAL COMPUTERS LLP,2016-03-01,Maharashtra,MUMBAI,1,2,645000,0,Computer and related activities
1,AAF-8299,AHASKAR ARYAA SOLAR LLP,2016-03-01,Karnataka,BANGALORE,0,2,6000000,0,"Electricity, Gas, Steam and Hot water supply"
1,AAF-8300,INGO ONLINE SOLUTIONS LLP,2016-03-01,Karnataka,BANGALORE,0,2,600000,0,Other Business Activities
1,AAF-8301,MECHIGNITE TECH SOLUTIONS LLP,2016-03-01,Karnataka,BANGALORE,0,2,600000,0,Other Business Activities
1,AAF-8302,AMAZINGWORLD VENTURES LLP,2016-03-01,Karnataka,BANGALORE,0,2,600000,0,Other Business Activities
1,AAF-8303,ROHAN FINCORP LLP,2016-03-01,Dadra & Nagar Haveli,AHMEDABAD,0,2,600000,0,Other Service activities
1,AAF-8304,PARAM SPACES LLP,2016-03-01,Maharashtra,PUNE,0,2,600000,0,Construction
1,AAF-8305,NY GLOBAL CONSULTING LLP,2016-03-01,Gujarat,AHMEDABAD,0,2,600000,0,Other Service activities
1,AAF-8306,HI FOODWAY AND HOSPITALITY LLP,2016-03-01,Maharashtra,PUNE,0,3,600000,0,Hotels and Restaurants
1,AAF-8307,SHOPYOURSTUFF RETAIL LLP,2016-03-01,Karnataka,BANGALORE,0,2,600000,0,"Retail trade,except of motor vehicles and motorcycles,repair of personal&household goods"
1,AAF-8308,SNS WEALTH CREATORS LLP,2016-03-01,Maharashtra,MUMBAI,0,2,600000,0,Other Business Activities
1,AAF-8309,MEDITRAVEL SERVICES LLP,2016-03-01,Karnataka,BANGALORE,0,2,60000,0,Other Business Activities
1,AAF-8310,TECHB CONSULTANCY SERVICES LLP,2016-03-01,Karnataka,BANGALORE,0,3,300000,0,Computer and related activities
1,AAF-8311,RAM DOOT INTRATRADE LLP,2016-03-01,Gujarat,AHMEDABAD,0,2,21000000,0,"Wholesale trade and commission trade, except of motor vehicles and motorcycles"
1,AAF-8312,999 CREATIVE SERVICES LLP,2016-03-01,Maharashtra,MUMBAI,0,2,600000,0,Other Business Activities
1,AAF-8313,MAHABALI INTRATRADE LLP,2016-03-01,Gujarat,AHMEDABAD,0,2,20160000,0,"Wholesale trade and commission trade, except of motor vehicles and motorcycles"
1,AAF-8314,RIJKE VOEDSEL FOODS LLP,2016-03-01,Karnataka,BANGALORE,0,2,60000,0,Other Business Activities
1,AAF-8315,URBAN GEAR GIFTS LLP,2016-03-01,Karnataka,BANGALORE,0,4,1200000,0,Other Business Activities
1,AAF-8316,SPOT NOTE MUSIC LLP,2016-03-01,Tamil Nadu,CHENNAI,0,2,3600000,0,Other Business Activities
1,AAF-8317,GOODTIMES INDIA TRADERS LLP,2016-03-01,Karnataka,BANGALORE,0,4,1200000,0,"Wholesale trade and commission trade, except of motor vehicles and motorcycles"
1,AAF-8318,KARMAVALI ENTERTAINMENT LLP,2016-03-01,Maharashtra,MUMBAI,0,2,600000,0,Other Service activities
1,AAF-8319,DNS TRADERS LLP,2016-03-01,Tamil Nadu,CHENNAI,0,4,2400000,0,"Wholesale trade and commission trade, except of motor vehicles and motorcycles"
1,AAF-8320,DHANRAJ CONSORTIUM LIMITED LIABILITY PAR,2016-03-01,Rajasthan,JAIPUR,2,2,15000000,0,Other Business Activities
1,AAF-8321,VAISHNAV CONSULTANCY LLP,2016-03-01,Delhi,DELHI,0,3,900000,0,Other Business Activities
1,AAF-8322,MAITREYA TRADING LLP,2016-03-01,Maharashtra,MUMBAI,0,2,600000,0,"Wholesale trade and commission trade, except of motor vehicles and motorcycles"
1,AAF-8323,GREEN TERRA PRODUCTS LIMITED LIABILITY P,2016-03-01,Maharashtra,PUNE,0,2,300000,0,Other Business Activities
1,AAF-8324,UDAIPUR LAUNDRY.COM LLP,2016-03-01,Rajasthan,JAIPUR,0,2,300000,0,Other Service activities
1,AAF-8325,LUMENART INTERNATIONAL LIGHTING LLP,2016-03-01,West Bengal,KOLKATA,0,6,3000000,0,Manufacture of electrical machinery and apparatus N.E.C.
1,AAF-8326,SILVER PETAL ADVISORY LLP,2016-03-01,Haryana,DELHI,1,2,600000,0,Other Business Activities
1,AAF-8327,ROCKSTAR INTERACTIVE INDIA LLP,2016-03-01,Karnataka,BANGALORE,0,2,4200000,0,Computer and related activities
1,AAF-8328,MEWAR HELICOPTER SERVICES LLP,2016-03-01,Rajasthan,JAIPUR,0,2,600000,0,Air Transport
1,AAF-8329,SYMMETRIX TOOLINGS LLP,2016-03-01,Maharashtra,PUNE,0,2,600000,0,Manufacture of machinery and equipment N.E.C.
1,AAF-8330,3AG BUSINESS AND TECHNOLOGY SOLUTIONS LL,2016-03-01,Rajasthan,JAIPUR,0,4,600000,0,Computer and related activities
1,AAF-8331,SHREE ASHTAVINAYAK GEMS LLP,2016-03-01,Gujarat,AHMEDABAD,1,2,600000,0,Other Business Activities
1,AAF-8332,RADOLENT DEVELOPERS LLP,2016-03-01,West Bengal,KOLKATA,0,2,600000,0,Real estate activities
1,AAF-8333,UNNATI INTERNATIONAL LLP,2016-03-01,West Bengal,KOLKATA,0,2,29550000,0,"Wholesale trade and commission trade, except of motor vehicles and motorcycles"
1,AAF-8334,GIPFEL HR SOLUTIONS LLP,2016-03-01,Gujarat,AHMEDABAD,0,2,120000,0,Other Service activities
1,AAF-8335,ECOCIATE SOLUTIONS LLP,2016-03-01,Orissa,ROC-CUTTACK,0,2,600000,0,Other Business Activities
1,AAF-8336,DHANYA TRADEMART LLP,2016-03-01,Madhya Pradesh,GWALIOR,0,2,60000000,0,"Wholesale trade and commission trade, except of motor vehicles and motorcycles"
1,AAF-8337,PANDIT NANDY SUPPLIER LLP,2016-03-01,West Bengal,KOLKATA,0,2,600000,0,Other Business Activities
1,AAF-8338,EINOVATE BRAND CONSULTING LLP,2016-03-01,Maharashtra,MUMBAI,0,3,180000,0,Other Business Activities
1,AAF-8339,DANGE CONSULTING & ADVISORY SERVICES (IN,2016-03-01,Maharashtra,MUMBAI,0,2,60000,0,Other Business Activities
1,AAF-8340,UNNATI PLASTICS LLP,2016-03-01,West Bengal,KOLKATA,0,2,6000000,0,"Wholesale trade and commission trade, except of motor vehicles and motorcycles"
1,AAF-8341,CALIMERA TECHNOLOGY LLP,2016-03-01,Bihar,ROC-PATNA,0,2,600000,0,Other Business Activities
1,AAF-8342,SRSK INFOTECH LLP,2016-03-01,Maharashtra,MUMBAI,0,2,66000,0,Construction
1,AAF-8343,FAIR LAWN TRADERS LLP,2016-03-01,West Bengal,KOLKATA,1,2,34170000,0,"Wholesale trade and commission trade, except of motor vehicles and motorcycles"
1,AAF-8344,SHRIYA DIGNOSTIC CENTER LLP,2016-03-01,Bihar,ROC-PATNA,0,2,600000,0,Health and Social Work
1,AAF-8345,UNIFOUR TRADERS LLP,2016-03-01,West Bengal,KOLKATA,0,2,600000,0,"Wholesale trade and commission trade, except of motor vehicles and motorcycles"
1,AAF-8346,CODEZONE TECH LLP,2016-03-01,Karnataka,BANGALORE,0,2,300000,0,Computer and related activities
1,AAF-8347,TECHNOVET INDUSTRIES LLP,2016-03-01,Bihar,ROC-PATNA,0,3,600000,0,Manufacture of furniture; manufacturing N.E.C.
1,AAF-8348,SHRIJIKANHA DAIRY FARMS AND HEALTHY MILK,2016-03-01,Madhya Pradesh,GWALIOR,0,3,600000,0,Manufacture of food products and beverages
1,AAF-8349,SAHAJEEVIKA AGRI SOLUTIONS LLP,2016-03-01,Bihar,ROC-PATNA,0,2,600000,0,"Activities Agriculture, Hunting and related Service activities"
1,AAF-8350,DHANRAJ HIGHRISE LLP,2016-03-01,Maharashtra,MUMBAI,0,2,300000,0,Other Business Activities
1,AAF-8351,SARVASHRESHTHA SOLUTIONS LLP,2016-03-01,Maharashtra,MUMBAI,0,2,600000,0,Other Business Activities
1,AAF-8352,URMI VENTURES LLP,2016-03-01,Maharashtra,MUMBAI,0,2,600000,0,"Supporting and auxiliary transport activities, activities of travel agencies"
1,AAF-8353,CHITRA LAND DEVELOPERS LLP,2016-03-02,Not assigned,CHENNAI,0,3,100000,0,Real estate activities
1,AAF-8354,WAYPOINT SPORTS LLP,2016-03-02,Not assigned,CHENNAI,0,3,100000,0,"Recreational, cultural and sporting activities"
1,AAF-8355,NAVYUG INFRAPROJECTS LLP,2016-03-02,Not assigned,JAIPUR,0,2,340000,0,Real estate activities
1,AAF-8356,ASYMPTOTES T-SHIRTS LLP,2016-03-02,Not assigned,JAIPUR,0,3,3000,0,"Retail trade,except of motor vehicles and motorcycles,repair of personal&household goods"
1,AAF-8357,HS3 DYNAMICS LLP,2016-03-02,Not assigned,DELHI,2,2,100000,0,Other Business Activities
1,AAF-8358,SHREELAKSHMI ONLINE RETAIL SERVICES LLP,2016-03-02,Not assigned,CHENNAI,0,2,200000,0,Other Business Activities
1,AAF-8359,MARGDARSHIKA EDUCATIONS LLP,2016-03-02,Not assigned,MUMBAI,0,2,15000,0,Education
1,AAF-8360,VENGARAI BUSINESS SOLUTIONS LLP,2016-03-02,Not assigned,COIMBATORE,0,2,100000,0,Other Business Activities
1,AAF-8361,REMEDI SPECIALITY MEDICINES LLP,2016-03-02,Not assigned,CHENNAI,0,2,600000,0,"Wholesale trade and commission trade, except of motor vehicles and motorcycles"
1,AAF-8362,LENORA LANDMARK LLP,2016-03-02,Not assigned,PUNE,2,3,100000,0,Construction
1,AAF-8363,KOSA WELLBEING LLP,2016-03-02,Not assigned,PUNE,0,2,100000,0,Other Service activities
1,AAF-8364,PROWELL TECHNOLOGIES LLP,2016-03-02,Not assigned,DELHI,0,2,100000,0,Other Service activities
1,AAF-8365,WAI AUTO WORLD LLP,2016-03-02,Not assigned,PUNE,0,2,100000,0,"Sale,Maintenance&Repair of motor vehicles and motor cycles;retail sale of automotive fuel"
1,AAF-8366,AGROSIAA AGRI-COMMODITIES ONLINE SERVICE,2016-03-02,Not assigned,PUNE,0,8,150000,0,Other Service activities
1,AAF-8367,LANDMARK FORTUNE ASSETS LLP,2016-03-02,Not assigned,PUNE,6,2,50000,0,Construction
1,AAF-8368,MASMARA COLLECTIONS LLP,2016-03-02,Not assigned,ERNAKULAM,0,2,100000,0,Other Business Activities
1,AAF-8369,SHINNING DEALTRADE LLP,2016-03-02,Not assigned,KOLKATA,0,2,100000,0,"Wholesale trade and commission trade, except of motor vehicles and motorcycles"
1,AAF-8370,YESWE ASSAYING AND HALLMARKING CENTRE LL,2016-03-02,Not assigned,ERNAKULAM,0,2,1000000,0,Other Business Activities
1,AAF-8371,MANIKRIT DISTRIBUTORS LLP,2016-03-02,Not assigned,KOLKATA,0,2,190000,0,"Wholesale trade and commission trade, except of motor vehicles and motorcycles"
1,AAF-8372,JAL TARANG SUPPLIERS LLP,2016-03-02,Not assigned,KOLKATA,0,2,352000,0,"Wholesale trade and commission trade, except of motor vehicles and motorcycles"
1,AAF-8373,VALLUVANAD ROOFINGS LIMITED LIABILITY PA,2016-03-02,Not assigned,ERNAKULAM,0,4,1000000,0,"Manufacture of fabricated metal products, except machinery and equipments"
1,AAF-8374,VIKAS TRANSPORT AND CARRIERS LLP,2016-03-02,Not assigned,COIMBATORE,5,2,15920000,0,Land transport; Transport via pipelines
1,AAF-8375,PRAMUKH BUILDERS LLP,2016-03-02,Not assigned,KOLKATA,0,2,1325000,0,Real estate activities
1,AAF-8376,NAMO MANAGEMENT ADVISORY SERVICES LLP,2016-03-02,Not assigned,COIMBATORE,0,2,100000,0,Other Business Activities
1,AAF-8377,MARUTI NANDAN INFOTECH LLP,2016-03-02,Not assigned,AHMEDABAD,0,3,3000100,0,"Wholesale trade and commission trade, except of motor vehicles and motorcycles"
1,AAF-8378,ATEMON TECHNOLOGY CONSULTANTS LLP,2016-03-02,Not assigned,ERNAKULAM,0,2,10000,0,Computer and related activities
1,AAF-8379,SUBHRASHI INFRACON LLP,2016-03-02,Not assigned,KOLKATA,0,2,200000,0,Other Business Activities
1,AAF-8380,FLYUP HR LLP,2016-03-02,Not assigned,ERNAKULAM,0,2,100000,0,Other Business Activities
1,AAF-8381,KUNTHUNATH IMPEX LLP,2016-03-02,Not assigned,AHMEDABAD,3,2,38000000,0,Manufacture of textiles
1,AAF-8382,RAJESH TRADELINK LLP,2016-03-02,Not assigned,AHMEDABAD,4,2,100000,0,Manufacture of tobacco products
1,AAF-8383,ALEXIS RETAILS LLP,2016-03-02,Not assigned,KOLKATA,0,2,1100000,0,Other Business Activities
1,AAF-8384,CALTUS TECHNOLOGYZ LLP,2016-03-02,Not assigned,ERNAKULAM,0,2,100000,0,Computer and related activities
1,AAF-8385,CREYETO TECH VENTURES LLP,2016-03-02,Not assigned,ERNAKULAM,0,2,100000,0,Computer and related activities
1,AAF-8386,DEVKRIPA FASHION LLP,2016-03-02,Not assigned,KOLKATA,0,2,200000,0,Other Business Activities
1,AAF-8387,WALTAZ INFRACON LLP,2016-03-02,Not assigned,KOLKATA,2,2,200000,0,Other Business Activities
1,AAF-8388,TEAM REMEDIES LLP,2016-03-02,Not assigned,AHMEDABAD,0,2,100000,0,Manufacture of chemicals and chemical products
1,AAF-8389,GANESHVANI DEALCOM LLP,2016-03-02,Not assigned,KOLKATA,0,2,200000,0,Other Business Activities
1,AAF-8390,MASTERMINDS ENTERPRISE LLP,2016-03-02,Not assigned,COIMBATORE,0,2,100000,0,"Wholesale trade and commission trade, except of motor vehicles and motorcycles"
1,AAF-8391,LIMOTEX PROJECTS AND INFRASTRUCTURE LIMI,2016-03-02,Not assigned,ERNAKULAM,7,2,100000,0,Construction
1,AAF-8392,FEMINA CLOTHING COMPANY LLP,2016-03-02,Not assigned,AHMEDABAD,0,2,110000,0,Manufacture of textiles
1,AAF-8393,GANADEV MARKETING LLP,2016-03-02,Not assigned,KOLKATA,2,2,8100000,0,"Wholesale trade and commission trade, except of motor vehicles and motorcycles"
1,AAF-8394,SUNMED CORPORATION LLP,2016-03-02,Not assigned,AHMEDABAD,2,2,20000000,0,"Wholesale trade and commission trade, except of motor vehicles and motorcycles"
1,AAF-8395,ECLECTIC STEEL LLP,2016-03-02,Not assigned,KOLKATA,0,2,100000,0,"Wholesale trade and commission trade, except of motor vehicles and motorcycles"
1,AAF-8396,UNIVERSAL DAWEEN FABRICATORS LLP,2016-03-02,Not assigned,ERNAKULAM,0,2,100000,0,Construction
1,AAF-8397,KANRAJ ESTATES LLP,2016-03-02,Not assigned,DELHI,2,2,450000,0,Real estate activities
1,AAF-8398,NEWAGE COMPUTECH SOLUTIONS LLP,2016-03-02,Not assigned,DELHI,2,2,150000,0,Computer and related activities
1,AAF-8399,COMET POLY TWISTERS LLP,2016-03-02,Not assigned,AHMEDABAD,0,2,1499200,0,Manufacture of textiles
1,AAF-8400,MERAKI REAL ESTATE CONSULTANTS LLP,2016-03-02,Not assigned,DELHI,0,2,50000,0,Real estate activities
1,AAF-8401,ENDODIAB CLINIC LLP,2016-03-02,Not assigned,ERNAKULAM,0,2,2000000,0,Health and Social Work
1,AAF-8402,ONYXAA DETAILERS LLP,2016-03-02,Not assigned,DELHI,0,3,300000,0,Other Business Activities
1,AAF-8403,KANISHK ADVISORS LLP,2016-03-02,Not assigned,DELHI,0,2,100000,0,Real estate activities
1,AAF-8404,DEPANNEUR TECHNOLOGIES LLP,2016-03-02,Not assigned,CHANDIGARH,0,2,100000,0,Other Business Activities
1,AAF-8405,KARTIKA FASHIONS LLP,2016-03-02,Not assigned,AHMEDABAD,0,2,100000,0,Manufacture of textiles
1,AAF-8406,JRD ADVISORS LLP,2016-03-02,Not assigned,DELHI,0,2,100000,0,Other Business Activities
1,AAF-8407,MAST MARINE SUPPLIES LLP,2016-03-02,Not assigned,MUMBAI,0,2,5000,0,Other Business Activities
1,AAF-8408,POOKKANI ASSOCIATED FLORISTS LIMITED LIA,2016-03-02,Not assigned,ERNAKULAM,0,3,500000,0,"Wholesale trade and commission trade, except of motor vehicles and motorcycles"
1,AAF-8409,STARLITE AUTOMATION LLP,2016-03-02,Not assigned,MUMBAI,0,2,50000,0,"Retail trade,except of motor vehicles and motorcycles,repair of personal&household goods"
1,AAF-8410,NIRALAS RESORTS LLP,2016-03-02,Not assigned,JAIPUR,0,2,100000,0,Hotels and Restaurants
1,AAF-8411,CR BOOKS LLP,2016-03-02,Not assigned,DELHI,0,2,100000,0,Other Business Activities
1,AAF-8412,DAKSHESH NUTRI FOODS LLP,2016-03-02,Not assigned,DELHI,0,2,100000,0,Manufacture of food products and beverages
1,AAF-8413,LANDMARK MEDINOVA LLP,2016-03-02,Not assigned,KOLKATA,0,2,100000,0,Real estate activities
1,AAF-8414,RIGHT CHOICE INFRA REALITY LLP,2016-03-02,Not assigned,KOLKATA,0,2,150000,0,Real estate activities
1,AAF-8415,GOPESHWARNATH FRESH FOODS LLP,2016-03-02,Not assigned,DELHI,0,2,100000,0,Manufacture of food products and beverages
1,AAF-8416,RIDHI SIDHI HOMZ LLP,2016-03-02,Not assigned,DELHI,0,2,100000,0,Real estate activities
1,AAF-8417,TWO BROTHERS TRADING LLP,2016-03-02,Not assigned,DELHI,0,2,100000,0,"Retail trade,except of motor vehicles and motorcycles,repair of personal&household goods"
1,AAF-8418,SHALFIN TRADING LLP,2016-03-02,Not assigned,ERNAKULAM,0,3,75000,0,"Wholesale trade and commission trade, except of motor vehicles and motorcycles"
1,AAF-8419,WORDMART TECHNOLOGIES LLP,2016-03-02,Not assigned,ERNAKULAM,0,2,50000,0,Computer and related activities
1,AAF-8420,SP TRADEWING LLP,2016-03-02,Not assigned,GWALIOR,0,2,10000000,0,"Wholesale trade and commission trade, except of motor vehicles and motorcycles"
1,AAF-8421,FESTOON PROPS & RENTALS LLP,2016-03-02,Not assigned,ERNAKULAM,0,5,500000,0,Other Service activities
1,AAF-8422,SUNRAYS TRADING LLP,2016-03-02,Not assigned,GWALIOR,0,2,10000000,0,"Wholesale trade and commission trade, except of motor vehicles and motorcycles"
1,AAF-8423,DEKORBUY HANDICRAFTS & HANDLOOMS LLP,2016-03-02,Not assigned,SHILLONG,1,2,100000,0,Other Business Activities
1,AAF-8424,SOGANI TRADING AND ASSOCIATES LLP,2016-03-02,Not assigned,GWALIOR,2,2,200000,0,"Retail trade,except of motor vehicles and motorcycles,repair of personal&household goods"
1,AAF-8425,SH INFRANET MANAGEMENT SOLUTIONS LLP,2016-03-02,Not assigned,ERNAKULAM,0,2,100000,0,Construction
1,AAF-8426,TRIMANA CONSTRUCTIONS LIMITED LIABILITY,2016-03-02,Not assigned,ERNAKULAM,0,3,1500000,0,Construction
1,AAF-8427,JAIN BROTHERS REAL ESTATE LLP,2016-03-02,Not assigned,GWALIOR,0,3,600000,0,Real estate activities
1,AAF-8428,INK VINIMAY LLP,2016-03-02,Not assigned,KOLKATA,2,2,1615500,0,"Wholesale trade and commission trade, except of motor vehicles and motorcycles"
1,AAF-8429,CARTMEE ONLINE SHOPPING LLP,2016-03-02,Not assigned,ERNAKULAM,0,2,10000,0,"Wholesale trade and commission trade, except of motor vehicles and motorcycles"
1,AAF-8430,CASPIAN LOGISTICS LLP,2016-03-02,Not assigned,ERNAKULAM,0,2,500000,0,Land transport; Transport via pipelines
1,AAF-8431,MR HOUSE CARE LLP,2016-03-02,Not assigned,AHMEDABAD,0,2,100000,0,Other Business Activities
1,AAF-8432,JAIMAANSI HOSPITALITY SERVICES LLP,2016-03-02,Not assigned,ERNAKULAM,0,2,100000,0,Hotels and Restaurants
1,AAF-8433,FRONT TRACK ECOM LLP,2016-03-02,Not assigned,ROC-CHHATTISGARH,0,2,200000,0,"Wholesale trade and commission trade, except of motor vehicles and motorcycles"
1,AAF-8434,ASIA RESEARCH PARTNERS LLP,2016-03-02,Not assigned,DELHI,0,2,1000000,0,Other Business Activities
1,AAF-8435,NORGATE TECHNOLOGIES LLP,2016-03-02,Not assigned,ERNAKULAM,0,2,100000,0,Other Business Activities
1,AAF-8436,DUGAD BUILDERS & DEVELOPERS LLP,2016-03-02,Not assigned,PUNE,5,2,100000,0,Construction
1,AAF-8437,LAYMAN'S LAWYER LLP,2016-03-02,Not assigned,KOLKATA,0,2,70000,0,Other Service activities
1,AAF-8438,GROPURE ORGANIC FARM LLP,2016-03-02,Not assigned,PUNE,0,3,50000,0,"Activities Agriculture, Hunting and related Service activities"
1,AAF-8439,HEPTAAPPS TECHNOLOGIES LLP,2016-03-02,Not assigned,BANGALORE,0,3,100000,0,Other Business Activities
1,AAF-8440,AMBROSIA ASSOCIATES LLP,2016-03-02,Not assigned,PUNE,0,13,100000,0,"Activities Agriculture, Hunting and related Service activities"
1,AAF-8441,BABA SYNDICATE LLP,2016-03-02,Not assigned,DELHI,0,2,300000,0,"Retail trade,except of motor vehicles and motorcycles,repair of personal&household goods"
1,AAF-8442,EVOYAGE ZONE LLP,2016-03-02,Not assigned,DELHI,0,3,50000,0,Other Business Activities
1,AAF-8443,GAJRAJ AGRO FUELS LLP,2016-03-03,Not assigned,DELHI,1,2,2172000,0,"Wholesale trade and commission trade, except of motor vehicles and motorcycles"
1,AAF-8444,CUBE FLEET SERVICES LLP,2016-03-03,Not assigned,DELHI,0,2,20000,0,"Supporting and auxiliary transport activities, activities of travel agencies"
1,AAF-8445,SAMSUN TOURS LLP,2016-03-03,Not assigned,PUNE,0,2,100000,0,"Supporting and auxiliary transport activities, activities of travel agencies"
1,AAF-8446,PMK DEVELOPERS LLP,2016-03-03,Not assigned,ERNAKULAM,0,2,300000,0,Construction
1,AAF-8447,SABUNANI ENTERPRISES LLP,2016-03-03,Not assigned,PUNE,0,4,200000,0,Real estate activities
1,AAF-8448,COCHINHERALD MEDIA NETWORK LLP,2016-03-03,Not assigned,ERNAKULAM,0,2,100000,0,"Publishing, printing and reproduction of recorded media"
1,AAF-8449,INJECT SOLAR LLP,2016-03-03,Not assigned,PUNE,0,2,50000,0,"Electricity, Gas, Steam and Hot water supply"
1,AAF-8450,EARLY BIRDS CHILDCARE SERVICES LLP,2016-03-03,Not assigned,PUNE,0,2,10000,0,Other Service activities
1,AAF-8451,RAM BIOCHEM AND FERTILIZERS LLP,2016-03-03,Not assigned,PUNE,0,2,50000,0,Manufacture of chemicals and chemical products
1,AAF-8452,YOUR ONLINE ADVERTISING AND ANALYTICS PA,2016-03-03,Not assigned,PUNE,0,2,10000,0,Other Business Activities
1,AAF-8453,TIRUPATI TECHNOLOGIES LLP,2016-03-03,Not assigned,KOLKATA,0,2,495000,0,Computer and related activities
1,AAF-8454,LULUKAS GOLD AND DIAMONDS LLP,2016-03-03,Not assigned,ERNAKULAM,0,2,10417500,0,"Retail trade,except of motor vehicles and motorcycles,repair of personal&household goods"
1,AAF-8455,UNITED PRAVASI BUILDERS AND DEVELOPERS L,2016-03-03,Not assigned,ERNAKULAM,0,2,200000,0,Real estate activities
1,AAF-8456,SOUTH NORTH PROJECTS LLP,2016-03-03,Not assigned,KOLKATA,0,2,3000000,0,Real estate activities
1,AAF-8457,AAA GARMENTS & RETAILS LLP,2016-03-03,Not assigned,PUNE,0,3,1000000,0,Other Business Activities
1,AAF-8458,ACUTE INSIGHT BUSINESS ANALYSIS LLP,2016-03-03,Not assigned,PUNE,0,2,100000,0,Computer and related activities
1,AAF-8459,SAILEELA MILK AND AGRO PRODUCTS LLP,2016-03-03,Not assigned,PUNE,0,2,100000,0,"Activities Agriculture, Hunting and related Service activities"
