Count,No,Name,Date,State,ROC,Partners,Designated Partners,Obligation,Division,Activity
1,AAG-0246,RENEWABLE SOFTWOOD LLP,2016-03-22,Delhi,DELHI,0,2,200000,0,"Manufacture articles of straw&plating materials wood&it's products&cork,except furniture"
1,AAG-0247,MANTAA INDIA COMPANY LLP,2016-03-22,Delhi,DELHI,1,2,200000,0,Manufacture of chemicals and chemical products
1,AAG-0248,UVK CONSTRUCTIONS LLP,2016-03-22,Maharashtra,MUMBAI,0,2,100000,0,Real estate activities
1,AAG-0249,BHAWNA COMPUTERS LLP,2016-03-22,West Bengal,KOLKATA,0,2,7688120,0,Computer and related activities
1,AAG-0250,HRACERS ASSOCIATES LLP,2016-03-22,Uttar Pradesh,KANPUR,0,2,200000,0,Other Business Activities
1,AAG-0251,BINARY AGRO FARMS LLP,2016-03-22,Delhi,DELHI,2,2,200000,0,"Activities Agriculture, Hunting and related Service activities"
1,AAG-0252,CONCEPT FARMS LLP,2016-03-22,Delhi,DELHI,2,2,200000,0,"Activities Agriculture, Hunting and related Service activities"
1,AAG-0253,INCEPTION PRINT PLUS LLP,2016-03-22,Delhi,DELHI,0,3,200000,0,"Publishing, printing and reproduction of recorded media"
1,AAG-0254,MANOR REAL ESTATE DEVELOPERS LLP,2016-03-22,Delhi,DELHI,2,2,200000,0,Real estate activities
1,AAG-0255,DREAMPLUS PROJECTS LLP,2016-03-22,Delhi,DELHI,2,2,200000,0,Real estate activities
1,AAG-0256,S6 VENTURES LLP,2016-03-22,Karnataka,BANGALORE,0,6,60000000,0,Real estate activities
1,AAG-0257,ROCKLAND AGRO LLP,2016-03-22,Delhi,DELHI,2,2,200000,0,"Activities Agriculture, Hunting and related Service activities"
1,AAG-0258,SATURN REALTORS LLP,2016-03-22,Delhi,DELHI,2,2,200000,0,Construction
1,AAG-0259,SCARLET TOWNSCAPES LLP,2016-03-22,Delhi,DELHI,2,2,200000,0,Real estate activities
1,AAG-0260,SAVOUR AGRO FARMS LLP,2016-03-22,Delhi,DELHI,2,2,200000,0,"Activities Agriculture, Hunting and related Service activities"
1,AAG-0261,SIERRAGOLD BUILDWELL LLP,2016-03-22,Delhi,DELHI,2,2,200000,0,Construction
1,AAG-0262,SHRI OM DIGI-SOLUTION LLP,2016-03-22,Delhi,DELHI,0,2,40000,0,Computer and related activities
1,AAG-0263,BETA ESTATES LLP,2016-03-22,Delhi,DELHI,2,2,200000,0,"Activities Agriculture, Hunting and related Service activities"
1,AAG-0264,ORGONEA URBAN HARVEST LLP,2016-03-22,Delhi,DELHI,0,4,400000,0,Other Business Activities
1,AAG-0265,CAZO TECHNOLOGIES LLP,2016-03-22,Telangana,HYDERABAD,0,2,20000,0,Computer and related activities
1,AAG-0266,SUPER ACE PROPBUILD LLP,2016-03-22,Delhi,DELHI,2,2,200000,0,Real estate activities
1,AAG-0267,WHITE LILY PROJECTS LLP,2016-03-22,Delhi,DELHI,2,2,200000,0,Real estate activities
1,AAG-0268,RITZY READYMADE GARMENTS LLP,2016-03-22,Delhi,DELHI,0,2,200000,0,Other Business Activities
1,AAG-0269,BRAHMA NIRMAAN CONSTRUCTIONS LLP,2016-03-22,Karnataka,BANGALORE,1,2,200000,0,Construction
1,AAG-0270,GAJKESARI ESTATES LLP,2016-03-22,West Bengal,KOLKATA,1,2,1000000,0,Real estate activities
1,AAG-0271,WISDOM FARMS LLP,2016-03-22,Delhi,DELHI,2,2,200000,0,"Activities Agriculture, Hunting and related Service activities"
1,AAG-0272,KAPIL ALCOTECH LLP,2016-03-22,Maharashtra,MUMBAI,0,2,200000,0,Manufacture of food products and beverages
1,AAG-0273,HONEYWELL BUILDCON LLP,2016-03-22,Delhi,DELHI,0,2,200000,0,Construction
1,AAG-0274,ACCOUNTS & TAX SOLUTIONS LLP,2016-03-22,Delhi,DELHI,0,2,20000,0,Other Business Activities
1,AAG-0275,HORIZON AVIONICS AND ELECTRONICS LLP,2016-03-22,Haryana,DELHI,0,2,200000,0,"Wholesale trade and commission trade, except of motor vehicles and motorcycles"
1,AAG-0276,NEELKANTH SILKS LLP,2016-03-22,Gujarat,AHMEDABAD,15,2,5050000,0,"Wholesale trade and commission trade, except of motor vehicles and motorcycles"
1,AAG-0277,MADLABS TOUR & TRAVELS LLP,2016-03-22,Delhi,DELHI,2,2,60000,0,"Supporting and auxiliary transport activities, activities of travel agencies"
1,AAG-0278,KTS MULTITRADE LLP,2016-03-22,Maharashtra,MUMBAI,0,3,2000000,0,Computer and related activities
1,AAG-0279,TRADE BEAT LLP,2016-03-22,Maharashtra,MUMBAI,0,2,20000,0,"Retail trade,except of motor vehicles and motorcycles,repair of personal&household goods"
1,AAG-0280,INDUDYOG COMPANY LLP,2016-03-22,Delhi,DELHI,1,2,14764000,0,Computer and related activities
1,AAG-0281,SHIVRASHI HOMES LLP,2016-03-22,West Bengal,KOLKATA,0,2,768000,0,"Wholesale trade and commission trade, except of motor vehicles and motorcycles"
1,AAG-0282,FLOURISH AGRO ESTATES LLP,2016-03-22,Delhi,DELHI,2,2,200000,0,"Activities Agriculture, Hunting and related Service activities"
1,AAG-0283,VISHRANT INFRAPROJECTS LLP,2016-03-22,Rajasthan,JAIPUR,0,2,200000,0,Real estate activities
1,AAG-0284,GLITTER AGRO FARMS LLP,2016-03-22,Delhi,DELHI,2,2,200000,0,"Activities Agriculture, Hunting and related Service activities"
1,AAG-0285,MANHATTAN FARMS LLP,2016-03-22,Delhi,DELHI,2,2,200000,0,"Activities Agriculture, Hunting and related Service activities"
1,AAG-0286,BALAJI GREENWOODS LLP,2016-03-22,Rajasthan,JAIPUR,0,2,200000,0,Real estate activities
1,AAG-0287,MULTIPLEX PLAZA LLP,2016-03-22,West Bengal,KOLKATA,0,2,768000,0,"Wholesale trade and commission trade, except of motor vehicles and motorcycles"
1,AAG-0288,AVENUE FARMS LLP,2016-03-22,Delhi,DELHI,2,2,200000,0,"Activities Agriculture, Hunting and related Service activities"
1,AAG-0289,SIERRAGOLD HEIGHTS DEVELOPERS LLP,2016-03-22,Delhi,DELHI,2,2,200000,0,Construction
1,AAG-0290,INDEX BUILDERS LLP,2016-03-22,Delhi,DELHI,0,2,200000,0,Manufacture of rubber and plastic products
1,AAG-0291,TECHNOSPOT SOLUTIONS LLP,2016-03-22,Maharashtra,MUMBAI,0,2,20000,0,Computer and related activities
1,AAG-0292,PASSIFLORA FOODS AND SERVICES LLP,2016-03-22,Madhya Pradesh,GWALIOR,3,2,200000,0,Other Business Activities
1,AAG-0293,BINARY ESTATE LLP,2016-03-22,Delhi,DELHI,1,2,200000,0,Real estate activities
1,AAG-0294,KALIBER DEVELOPERS LLP,2016-03-22,Delhi,DELHI,1,2,1000000,0,Construction
1,AAG-0295,LEGEND BUILDTECH LLP,2016-03-22,Delhi,DELHI,1,2,200000,0,Construction
1,AAG-0296,NIVEDAN CONSULTANTS LLP,2016-03-22,West Bengal,KOLKATA,2,2,5530000,0,"Wholesale trade and commission trade, except of motor vehicles and motorcycles"
1,AAG-0297,CITYLINKER BUILDCON LLP,2016-03-22,Delhi,DELHI,1,2,200000,0,Construction
1,AAG-0298,GENUS ESTATE LLP,2016-03-22,Delhi,DELHI,1,2,200000,0,Real estate activities
1,AAG-0299,ANSHUMAN APR ENTERPRISES LLP,2016-03-22,Delhi,DELHI,0,2,200000,0,Other Business Activities
1,AAG-0300,PANORAMA SUPPLIERS LLP,2016-03-22,West Bengal,KOLKATA,0,2,400000,0,"Wholesale trade and commission trade, except of motor vehicles and motorcycles"
1,AAG-0301,LAVISH BUILDWELL LLP,2016-03-22,Delhi,DELHI,0,2,200400,0,Construction
1,AAG-0302,SION BUILDCON LLP,2016-03-22,Delhi,DELHI,0,2,200000,0,Construction
1,AAG-0303,INDO MULTI TRADELINK LLP,2016-03-22,Gujarat,AHMEDABAD,7,2,200000,0,"Wholesale trade and commission trade, except of motor vehicles and motorcycles"
1,AAG-0304,GRAND TIERRAS LLP,2016-03-22,Delhi,DELHI,0,3,200000,0,Other Business Activities
1,AAG-0305,COSMOS FINVEST SERVICES LLP,2016-03-22,Gujarat,AHMEDABAD,0,2,200000,0,"Retail trade,except of motor vehicles and motorcycles,repair of personal&household goods"
1,AAG-0306,ATLANTA BUILDCON LLP,2016-03-22,Delhi,DELHI,0,2,200000,0,Construction
1,AAG-0307,GANAK MANAGEMENT CONSULTING LLP,2016-03-22,Delhi,DELHI,0,2,40000,0,Other Business Activities
1,AAG-0308,AQUILAS LEGAL SOLUTIO LLP,2016-03-22,Delhi,DELHI,1,3,20000,0,Other Business Activities
1,AAG-0309,NUMERICA ACTUARIAL CONSULTING LLP,2016-03-22,Delhi,DELHI,0,2,200000,0,Other Business Activities
1,AAG-0310,JUSTWASH CAR CARE LLP,2016-03-22,Karnataka,BANGALORE,0,2,200000,0,Other Service activities
1,AAG-0311,Q AND M VISUALS LLP,2016-03-22,Delhi,DELHI,0,2,200000,0,Other Business Activities
1,AAG-0312,INDO WELL ENTERPRISES LLP,2016-03-22,Delhi,DELHI,0,2,200000,0,Other Business Activities
1,AAG-0313,INDRADEV VINIMAY LLP,2016-03-22,West Bengal,KOLKATA,0,2,1320000,0,"Wholesale trade and commission trade, except of motor vehicles and motorcycles"
1,AAG-0314,AJAY AGGARWAL PROPERTIES LLP,2016-03-22,Delhi,DELHI,1,2,200000,0,Real estate activities
1,AAG-0315,VERBENA REAL ESTATE LLP,2016-03-22,Delhi,DELHI,0,2,200000,0,Real estate activities
1,AAG-0316,AARADHYA BUILDPROP LLP,2016-03-22,Delhi,DELHI,0,2,200000,0,Other Business Activities
1,AAG-0317,SZAFA DESIGN STUDIO LLP,2016-03-22,Delhi,DELHI,0,2,200000,0,Manufacture of wearing apparel;dressing and dyeing of fur
1,AAG-0318,CLAD MEDICAL LIMITED LIABILITY PARTNERSH,2016-03-22,Delhi,DELHI,0,2,200000,0,"Retail trade,except of motor vehicles and motorcycles,repair of personal&household goods"
1,AAG-0319,VERBENA BUILDWELL LLP,2016-03-22,Delhi,DELHI,4,2,200000,0,Real estate activities
1,AAG-0320,SUNRISE BUILDMORE LLP,2016-03-22,Delhi,DELHI,3,2,36800000,0,Construction
1,AAG-0321,PERFECT IT.SEZ LLP,2016-03-22,Delhi,DELHI,3,2,1000000,0,Computer and related activities
1,AAG-0322,AMSARA INFRA INDIA LLP,2016-03-22,Delhi,DELHI,0,2,200000,0,Construction
1,AAG-0323,DR REALBUILD LLP,2016-03-22,Delhi,DELHI,3,2,200000,0,Real estate activities
1,AAG-0324,NORTHERN INDIA PAINT COLOUR VARNISH AND,2016-03-22,Delhi,DELHI,0,2,920000,0,Hotels and Restaurants
1,AAG-0325,X- NINE INFOTECH LLP,2016-03-22,Delhi,DELHI,3,2,200000,0,Computer and related activities
1,AAG-0326,V N REALBUILD LLP,2016-03-22,Delhi,DELHI,3,2,200000,0,Real estate activities
1,AAG-0327,FLAIR REALTORS LLP,2016-03-22,Delhi,DELHI,0,2,400000,0,Real estate activities
1,AAG-0328,ALLWORTH TRADERS LLP,2016-03-22,West Bengal,KOLKATA,0,2,6950000,0,"Wholesale trade and commission trade, except of motor vehicles and motorcycles"
1,AAG-0329,OSTRICH REALTORS LLP,2016-03-22,Delhi,DELHI,3,2,200000,0,Real estate activities
1,AAG-0330,STERLING REALTECH LLP,2016-03-22,Delhi,DELHI,0,2,120000000,0,Real estate activities
1,AAG-0331,MODERN PORTFOLIO LLP,2016-03-22,Delhi,DELHI,2,2,11837760,0,Other Business Activities
1,AAG-0332,C AND C BUILDCON LLP,2016-03-22,Delhi,DELHI,2,2,7450000,0,Real estate activities
1,AAG-0333,VR PROPERTIES LLP,2016-03-22,West Bengal,KOLKATA,1,2,2520000,0,Real estate activities
1,AAG-0334,AKNK ENTERPRISES LLP,2016-03-22,Delhi,DELHI,0,2,2000000,0,Manufacture of food products and beverages
1,AAG-0335,S.G.M. POLYMERS LLP,2016-03-22,Delhi,DELHI,0,4,2000000,0,"Wholesale trade and commission trade, except of motor vehicles and motorcycles"
1,AAG-0336,IMPULSE INDIA ADVISORY SERVICES LLP,2016-03-22,Delhi,DELHI,0,2,20000,0,Other Business Activities
1,AAG-0337,ARCH VINIMAY LLP,2016-03-22,West Bengal,KOLKATA,0,3,17750000,0,"Wholesale trade and commission trade, except of motor vehicles and motorcycles"
1,AAG-0338,COMUNIQUE ADVERTISERS LLP,2016-03-22,Delhi,DELHI,0,2,20000,0,Other Business Activities
1,AAG-0339,TANMAY ADVISORY SERVICES LLP,2016-03-22,Karnataka,BANGALORE,0,3,300000,0,Activities auxiliary to financial intermediation
1,AAG-0340,METROPOLIS INFRASTRUCTURE LLP,2016-03-22,Delhi,DELHI,0,2,200000,0,Real estate activities
1,AAG-0341,DHANSUBH TRADERS LLP,2016-03-22,West Bengal,KOLKATA,3,4,1000000,0,"Wholesale trade and commission trade, except of motor vehicles and motorcycles"
1,AAG-0342,AYANA ENTERPRISE LLP,2016-03-22,Maharashtra,MUMBAI,0,3,200000,0,Construction
1,AAG-0343,GLOBAL AD NETWORK LLP,2016-03-22,Delhi,DELHI,0,2,20000,0,Computer and related activities
1,AAG-0344,BRISK LOGISTICS LLP,2016-03-22,Maharashtra,MUMBAI,0,2,40000,0,Post and telecommunications
1,AAG-0345,A GOOD FEELING STUDIO LLP,2016-03-22,Maharashtra,MUMBAI,0,2,200000,0,Other Business Activities
1,AAG-0346,VALIANT ADVISORY SERVICES LLP,2016-03-22,Maharashtra,MUMBAI,0,2,10000,0,Other Business Activities
1,AAG-0347,VALCORE CAPITAL ADVISORS LLP,2016-03-22,Maharashtra,MUMBAI,0,2,200000,0,Activities auxiliary to financial intermediation
1,AAG-0348,CROSSROADS DIGITAL LLP,2016-03-22,Maharashtra,MUMBAI,0,2,200000,0,Other Business Activities
1,AAG-0349,WEST COAST ADVERTISING LLP,2016-03-22,Maharashtra,MUMBAI,0,2,100000,0,Other Business Activities
1,AAG-0350,TOOLBOX SOLUTIONS LLP,2016-03-22,Maharashtra,MUMBAI,0,3,300000,0,Other Business Activities
1,AAG-0351,SECURIT EDUCATION LLP,2016-03-23,Karnataka,BANGALORE,0,2,40000,0,Education
1,AAG-0352,SSK BUILDMART LLP,2016-03-23,Rajasthan,JAIPUR,0,3,200000,0,"Wholesale trade and commission trade, except of motor vehicles and motorcycles"
1,AAG-0353,GROWCOHOLICS VENTURES LLP,2016-03-23,Maharashtra,MUMBAI,7,5,1500000,0,Other Business Activities
1,AAG-0354,PNR INVESTMENT ADVISORS LLP,2016-03-23,Delhi,DELHI,2,2,1792000,0,Activities auxiliary to financial intermediation
1,AAG-0355,SUDHEENDRA AND COMPANY LLP,2016-03-23,Maharashtra,MUMBAI,0,2,20000,0,Other Business Activities
1,AAG-0356,YNG BUILDERS LLP,2016-03-23,Delhi,DELHI,0,2,200000,0,Real estate activities
1,AAG-0357,CLASSYAGRO LLP,2016-03-23,Maharashtra,MUMBAI,0,2,200000,0,Construction
1,AAG-0358,YGR INFRASTRUCTURES LLP,2016-03-23,Delhi,DELHI,0,2,200000,0,Real estate activities
1,AAG-0359,TEAMJIGA RETAIL LLP,2016-03-23,Kerala,ERNAKULAM,0,2,200000,0,"Retail trade,except of motor vehicles and motorcycles,repair of personal&household goods"
1,AAG-0360,CADEM HRM SERVICES LLP,2016-03-23,Tamil Nadu,COIMBATORE,0,2,120000,0,Other Business Activities
1,AAG-0361,DEVKI SOLUTIONS LLP,2016-03-23,Rajasthan,JAIPUR,0,3,200000,0,Computer and related activities
1,AAG-0362,EVENTROUTE EVENTS LLP,2016-03-23,Delhi,DELHI,0,2,20000,0,Other Business Activities
1,AAG-0363,GREENS INSURANCE MARKETING LLP,2016-03-23,Kerala,ERNAKULAM,0,6,2400000,0,"Insurance and pension funding,except compulsory social security"
1,AAG-0364,SHETBRO HOTELS AND RESORTS LLP,2016-03-23,Maharashtra,MUMBAI,3,2,1980000,0,Real estate activities
1,AAG-0365,ACUMEN CORPORATE CONSULTANTS LLP,2016-03-23,Delhi,DELHI,0,2,20000,0,Other Business Activities
1,AAG-0366,DRM RETAILS LLP,2016-03-23,Rajasthan,JAIPUR,1,2,600000,0,"Wholesale trade and commission trade, except of motor vehicles and motorcycles"
1,AAG-0367,PADAM INFOSERVICES LLP,2016-03-23,Punjab,CHANDIGARH,0,2,160000,0,Other Business Activities
1,AAG-0368,REINA CONSULTING LLP,2016-03-23,Haryana,DELHI,0,2,200000,0,Other Business Activities
1,AAG-0369,VAIDURYA GRANITES & M SANDS LLP,2016-03-23,Kerala,ERNAKULAM,0,3,2000000,0,Other Mining and Quarrying
1,AAG-0370,CONCORDE SHELTERS . LLP,2016-03-23,Karnataka,BANGALORE,1,2,1800000,0,Other Business Activities
1,AAG-0371,MOSANTA MARKETING LLP,2016-03-23,Kerala,ERNAKULAM,0,3,200000,0,Other Business Activities
1,AAG-0372,BAKEO BUSINESS ENTERPRISES LLP,2016-03-23,Kerala,ERNAKULAM,0,2,200000,0,"Wholesale trade and commission trade, except of motor vehicles and motorcycles"
1,AAG-0373,FALCON FINANCIAL IT AND TAX SOLUTIONS LL,2016-03-23,Delhi,DELHI,1,2,20000,0,Other Service activities
1,AAG-0374,MAHAVIR DEVELOPERS & BUILDERS LLP,2016-03-23,Maharashtra,MUMBAI,0,2,200000,0,Construction
1,AAG-0375,ARVICS TIRUR LIFESTYLE LLP,2016-03-23,Kerala,ERNAKULAM,0,2,4000000,0,"Retail trade,except of motor vehicles and motorcycles,repair of personal&household goods"
1,AAG-0376,PARALLEL TECHNOLOGIES LLP,2016-03-23,Delhi,DELHI,0,2,2000000,0,Computer and related activities
1,AAG-0377,COROCRAFT LLP,2016-03-23,Rajasthan,JAIPUR,0,2,20000,0,Manufacture of paper and paper
1,AAG-0378,DAKSHA FASHION STUDIO LLP,2016-03-23,Kerala,ERNAKULAM,0,2,200000,0,Other Business Activities
1,AAG-0379,ANCROWN MINING AND MINERALS INDIA LLP,2016-03-23,Chhaattisgarh,ROC-CHHATTISGARH,0,2,400000,0,Other Mining and Quarrying
1,AAG-0380,IRINGS TECHNOLOGIES LLP,2016-03-23,Kerala,ERNAKULAM,1,2,200000,0,Computer and related activities
1,AAG-0381,MAST JEWELLERY DISTRIBUTIONS LLP,2016-03-23,Karnataka,BANGALORE,0,2,34900000,0,Other Business Activities
1,AAG-0382,GENEROTRADE EXIM LLP,2016-03-23,Maharashtra,MUMBAI,0,2,22360000,0,Manufacture of textiles
1,AAG-0383,ZAMORINS CONVENTION CENTRE LLP,2016-03-23,Kerala,ERNAKULAM,0,2,200000,0,"Recreational, cultural and sporting activities"
1,AAG-0384,FORTUNE TIMBER (INDIA) LLP,2016-03-23,Delhi,DELHI,0,2,200000,0,"Manufacture articles of straw&plating materials wood&it's products&cork,except furniture"
1,AAG-0385,SNUG LOGISTICS LLP,2016-03-23,Kerala,ERNAKULAM,0,2,400000,0,"Supporting and auxiliary transport activities, activities of travel agencies"
1,AAG-0386,FOURBYFIX MOTOR SERVICES LLP,2016-03-23,Kerala,ERNAKULAM,0,2,200000,0,"Manufacture of motor vehicles,trailers and semi-trailers"
1,AAG-0387,AZDA SUITES LLP,2016-03-23,Kerala,ERNAKULAM,0,3,2000000,0,Hotels and Restaurants
1,AAG-0388,ORIENTAL BUILDESTATE LLP,2016-03-23,Rajasthan,JAIPUR,0,2,200000,0,Real estate activities
1,AAG-0389,BARDIYA PROPERTIES LLP,2016-03-23,Rajasthan,JAIPUR,0,3,2000000,0,Real estate activities
1,AAG-0390,EVENING EXPERTS ENTERTAINERS LLP,2016-03-23,Punjab,CHANDIGARH,0,2,50000,0,Other Business Activities
1,AAG-0391,FOREFRONT MANAGEMENT SERVICES LLP,2016-03-23,Telangana,HYDERABAD,0,3,10000000,0,Other Business Activities
1,AAG-0392,GLOBAL MARINE POWER LLP,2016-03-23,Tamil Nadu,CHENNAI,0,3,600000,0,Manufacture of machinery and equipment N.E.C.
1,AAG-0393,MG TECHNOPOS IT SERVICES LLP,2016-03-23,Karnataka,BANGALORE,0,2,20000,0,Computer and related activities
1,AAG-0394,PYRAMID TRADELINKS LLP,2016-03-23,Rajasthan,JAIPUR,14,2,30200000,0,"Wholesale trade and commission trade, except of motor vehicles and motorcycles"
1,AAG-0395,KUSH BUILDCON LLP,2016-03-23,Maharashtra,MUMBAI,0,2,200000,0,Construction
1,AAG-0396,TRAVELABLE LABS LLP,2016-03-23,Karnataka,BANGALORE,0,2,20000,0,Computer and related activities
1,AAG-0397,WEALTHY IDEAS REALTY LLP,2016-03-23,Karnataka,BANGALORE,0,2,100000,0,Construction
1,AAG-0398,SECLUDED STAYS LLP,2016-03-23,Maharashtra,MUMBAI,0,2,200000,0,"Supporting and auxiliary transport activities, activities of travel agencies"
1,AAG-0399,PINAKINI FINANCE AND INVESTMENTS (INDIA),2016-03-23,Tamil Nadu,CHENNAI,2,2,4254400,0,"Retail trade,except of motor vehicles and motorcycles,repair of personal&household goods"
1,AAG-0400,RANI MERCANTILE LLP,2016-03-23,West Bengal,KOLKATA,3,3,44224000,0,Real estate activities
1,AAG-0401,MICL BUILDERS LLP,2016-03-23,Maharashtra,MUMBAI,0,2,200000,0,Real estate activities
1,AAG-0402,WEBXCES TECHNOLOGIES LLP,2016-03-23,Maharashtra,MUMBAI,0,2,200000,0,Computer and related activities
1,AAG-0403,LANDPOINT SURVEYS LLP,2016-03-23,Karnataka,BANGALORE,0,2,400000,0,Other Business Activities
1,AAG-0404,JHARNA REAL ESTATES LLP,2016-03-23,Maharashtra,MUMBAI,0,3,200000,0,Construction
1,AAG-0405,VISION2REALITY EVENT MANAGEMENT LLP,2016-03-23,Goa,GOA,0,2,20000,0,Other Business Activities
1,AAG-0406,KESARIYAJI PROPERTIES AND DEVELOPERS LLP,2016-03-23,Maharashtra,MUMBAI,0,2,200000,0,Real estate activities
1,AAG-0407,SPI GREEN ENERGY LLP,2016-03-23,Tamil Nadu,CHENNAI,0,2,200000,0,"Electricity, Gas, Steam and Hot water supply"
1,AAG-0408,AKIN WAREHOUSING SOLUTIONS LLP,2016-03-23,Rajasthan,JAIPUR,0,2,200000,0,Other Business Activities
1,AAG-0409,VISION AGRO LAND VENTURES LLP,2016-03-23,Maharashtra,MUMBAI,0,2,100000,0,Construction
1,AAG-0410,THE COMFORT CLUBWEAR LLP,2016-03-23,Maharashtra,MUMBAI,0,2,200000,0,Manufacture of wearing apparel;dressing and dyeing of fur
1,AAG-0411,SAKAKA ENTERPRISES LLP,2016-03-23,Maharashtra,MUMBAI,0,2,200000,0,Other Business Activities
1,AAG-0412,NILGIRI REALTY LLP,2016-03-23,Maharashtra,MUMBAI,0,2,200000,0,Real estate activities
1,AAG-0413,BOOKCOMFY SERVICES LLP,2016-03-23,Karnataka,BANGALORE,0,2,200000,0,Other Service activities
1,AAG-0414,VIDHANI CONSTRUCTIONS LLP,2016-03-23,Maharashtra,MUMBAI,10,2,32850000,0,Real estate activities
1,AAG-0415,HAPPY DEALERS LLP,2016-03-23,West Bengal,KOLKATA,2,3,1499000,0,"Wholesale trade and commission trade, except of motor vehicles and motorcycles"
1,AAG-0416,SAMARTH ADVISORS LLP,2016-03-23,Maharashtra,MUMBAI,0,2,200000,0,Other Business Activities
1,AAG-0417,DAMN TRADING LLP,2016-03-23,West Bengal,KOLKATA,0,4,5706000,0,"Wholesale trade and commission trade, except of motor vehicles and motorcycles"
1,AAG-0418,ZEN HEALTHCARE PRODUCTS LLP,2016-03-23,West Bengal,KOLKATA,3,3,39435980,0,Real estate activities
1,AAG-0419,SHRIYAM COMMODITIES INTERMEDIARY LLP,2016-03-23,Maharashtra,MUMBAI,0,2,98000000,0,Other Business Activities
1,AAG-0420,BLUEBELL WEALTH REALTY LLP,2016-03-23,Karnataka,BANGALORE,0,2,100000,0,Construction
1,AAG-0421,SNP VENTURES LLP,2016-03-23,Telangana,HYDERABAD,4,3,560029340,0,Real estate activities
1,AAG-0422,A TO Z BROKING SERVICES LLP,2016-03-23,Maharashtra,MUMBAI,5,3,90000000,0,Activities auxiliary to financial intermediation
1,AAG-0423,SUNBRIGHT CEMENT AGENCIES LLP,2016-03-23,Maharashtra,MUMBAI,0,6,232000,0,"Wholesale trade and commission trade, except of motor vehicles and motorcycles"
1,AAG-0424,ULTRA BUSINESS CONSULTANTS LLP,2016-03-23,Tamil Nadu,CHENNAI,0,2,40000,0,Other Business Activities
1,AAG-0425,DATAMARK PRODAPT INDIA BPO LLP,2016-03-23,Tamil Nadu,CHENNAI,2,2,1000000,0,Computer and related activities
1,AAG-0426,VIYAN EDUCATION AND IT SERVICES LLP,2016-03-23,Tamil Nadu,CHENNAI,0,2,160000,0,Education
1,AAG-0653,BADRINATH VYAPAAR LLP,2016-03-29,KOLKATA,KOLKATA,0,2,18840000,0,"Wholesale trade and commission trade, except of motor vehicles and motorcycles"
1,AAG-0654,PASUPATI STOCK BROKING LLP,2016-03-29,KOLKATA,KOLKATA,1,2,1620000,0,Other Service activities
1,AAG-0655,GRAFFITO EDUCATION LLP,2016-03-29,PUNE,PUNE,0,2,100000,0,Education
1,AAG-0656,IVIA BEAUTE LLP,2016-03-29,DELHI,DELHI,1,2,1500000,0,Other Business Activities
1,AAG-0657,TRINETRA VINIMAY LLP,2016-03-29,KOLKATA,KOLKATA,0,2,260000,0,Other Service activities
1,AAG-0658,AYUSHPA ORGANICS LLP,2016-03-29,PUNE,PUNE,0,3,50000,0,Other Business Activities
1,AAG-0659,GREEN THEME AGRO LLP,2016-03-29,PUNE,PUNE,0,2,100000,0,"Activities Agriculture, Hunting and related Service activities"
1,AAG-0660,STAR RADIANT POWER LLP,2016-03-29,PUNE,PUNE,0,2,20000,0,Other Business Activities
1,AAG-0661,BROADWAY FINANCIAL CONSULTANTS LLP,2016-03-29,KOLKATA,KOLKATA,2,2,100000,0,"Financial intermediation, except insurance and pension funding"
1,AAG-0662,NEELANCHAL HAPPY GRIHA LLP,2016-03-29,BANGALORE,BANGALORE,0,2,100000,0,Construction
1,AAG-0663,VASTUPAL MANAGEMENT SERVICES LLP,2016-03-29,KOLKATA,KOLKATA,1,2,40000000,0,"Financial intermediation, except insurance and pension funding"
1,AAG-0664,M S C K PROJECTS LLP,2016-03-29,DELHI,DELHI,0,3,100000,0,Real estate activities
1,AAG-0665,QUEST HOME PRODUCTS LLP,2016-03-29,DELHI,DELHI,1,2,402000,0,Manufacture of rubber and plastic products
1,AAG-0666,SPARK PROMOTERS LLP,2016-03-29,KOLKATA,KOLKATA,3,2,5450000,0,Real estate activities
1,AAG-0667,TRIMUDRA VYAPAAR LLP,2016-03-29,KOLKATA,KOLKATA,2,2,4020000,0,"Wholesale trade and commission trade, except of motor vehicles and motorcycles"
1,AAG-0668,ESS AND BEE RESORTS LLP,2016-03-29,DELHI,DELHI,0,2,3500000,0,Hotels and Restaurants
1,AAG-0669,RELIANCE GROUP TRADECOM LLP,2016-03-29,MUMBAI,MUMBAI,0,2,138030400,0,"Wholesale trade and commission trade, except of motor vehicles and motorcycles"
1,AAG-0670,HOPES ACCOUNTING SERVICES LLP,2016-03-29,AHMEDABAD,AHMEDABAD,0,3,100000,0,Other Business Activities
1,AAG-0671,YUKTAMEDIA LLP,2016-03-29,PUNE,PUNE,0,2,500000,0,Other Business Activities
1,AAG-0672,RELIANCE GROUP COMMERCIALS LLP,2016-03-29,MUMBAI,MUMBAI,0,2,117228000,0,"Wholesale trade and commission trade, except of motor vehicles and motorcycles"
1,AAG-0673,MOTIF FINANCIAL CONSULTANTS LLP,2016-03-29,DELHI,DELHI,0,2,500000,0,Other Business Activities
1,AAG-0674,CITRON SERVIZIO LLP,2016-03-29,KANPUR,KANPUR,0,3,30000,0,Other Business Activities
1,AAG-0675,BIG COMET INDIA INFOTECH LLP,2016-03-29,GWALIOR,GWALIOR,0,2,50000,0,Computer and related activities
1,AAG-0676,SYMBIOTEC STEROIDS LLP,2016-03-29,GWALIOR,GWALIOR,0,2,3333440,0,Manufacture of chemicals and chemical products
1,AAG-0712,JPS HITECH INFRAENGINEERS LLP,2016-03-30,KANPUR,KANPUR,0,2,1000000,0,Real estate activities
1,AAG-0677,INTEGRATED HEALTH VENTURES LLP,2016-03-29,CHENNAI,CHENNAI,0,2,100000,0,Computer and related activities
1,AAG-0678,QUALFON TECHNOLOGY SUPPORT SERVICES LLP,2016-03-29,DELHI,DELHI,0,2,2000,0,Computer and related activities
1,AAG-0679,VIDHI TRADING & ADVISORY LLP,2016-03-29,AHMEDABAD,AHMEDABAD,0,2,100000,0,Activities auxiliary to financial intermediation
1,AAG-0782,TRIP2LEARN TOURISM LLP,2016-03-30,PUNE,PUNE,0,2,500000,0,"Supporting and auxiliary transport activities, activities of travel agencies"
1,AAG-0680,DAFFODIL DEALER LLP,2016-03-29,KOLKATA,KOLKATA,4,2,2160000,0,Other Business Activities
1,AAG-0681,SHIVALIK STRUCTURES LLP,2016-03-29,AHMEDABAD,AHMEDABAD,0,2,100000,0,Real estate activities
1,AAG-0783,SRI SPARKLE LLP,2016-03-30,BANGALORE,BANGALORE,0,2,100000,0,Manufacture of chemicals and chemical products
1,AAG-0682,V.M.CHETTIAR & SONS INDIA LLP,2016-03-29,CHENNAI,CHENNAI,4,5,2351210,0,Activities auxiliary to financial intermediation
1,AAG-0784,ZISTA PHARMA LLP,2016-03-30,CHENNAI,CHENNAI,0,2,10000,0,Manufacture of chemicals and chemical products
1,AAG-0785,RULY INFOTECH SERVICES LLP,2016-03-30,DELHI,DELHI,0,2,100000,0,Other Business Activities
1,AAG-0786,EDGE INFRATECH LLP,2016-03-30,DELHI,DELHI,0,3,100000,0,Real estate activities
1,AAG-0787,INDRADANUSH PREMISES LLP,2016-03-30,MUMBAI,MUMBAI,0,2,1000000,0,Real estate activities
1,AAG-0788,DELTECH INFRA LLP,2016-03-30,DELHI,DELHI,0,2,200000,0,Real estate activities
1,AAG-0789,HARITA PROPERTIES LLP,2016-03-30,CHENNAI,CHENNAI,0,2,10100000,0,Real estate activities
1,AAG-0790,WHET HOSPITALITY SERVICE LLP,2016-03-30,DELHI,DELHI,0,2,20000,0,Other Business Activities
1,AAG-0791,ROHAN SIDHI LOGISTICS LLP,2016-03-30,PUNE,PUNE,10,2,1000000,0,Construction
1,AAG-0792,MEERU INFRAPROJECT DEVELOPERS LLP,2016-03-30,GWALIOR,GWALIOR,6,2,104000,0,Construction
1,AAG-0793,LAKEWAY PROPERTIES LLP,2016-03-30,PUNE,PUNE,8,9,324437500,0,Construction
1,AAG-0794,NEO SCANS LLP,2016-03-30,GOA,GOA,0,3,9000000,0,Health and Social Work
1,AAG-0795,DHARATI CONSTRUCTION LLP,2016-03-30,MUMBAI,MUMBAI,5,3,25000000,0,Construction
1,AAG-0796,MILAN INTERMEDIATES LLP,2016-03-30,AHMEDABAD,AHMEDABAD,7,2,1600000,0,Manufacture of chemicals and chemical products
